book_id,name,link,authors
404,Thơ Hàn Mặc Tử - Văn Học Trong Nhà Trường,https://tiki.vn/product-p120165303.html?spid=120165304,Hàn Mặc Tử
405,Những Chiếc Ghế Trong Căn Bếp Nhỏ (Thơ),https://tiki.vn/product-p103596493.html?spid=103596523,"Nguyễn Phong Việt, Đặng Hồng Quân"
406,Thương (Thơ),https://tiki.vn/product-p90985722.html?spid=90985724,Nhiều tác giả
407,Chờ Mãi Cơn Mưa Rào Rất Lạ (Thơ),https://tiki.vn/product-p57047799.html?spid=227176786,Thanh Thảo
408,Văn Học Trong Nhà Trường : Thơ Nguyến Khuyến,https://tiki.vn/product-p44251089.html?spid=44251090,Nguyễn Khuyến
409,Những Người Đàn Bà Trở Về,https://tiki.vn/product-p19932586.html?spid=19932587,Bình Nguyên Trang
410,Đạo Đức Kinh,https://tiki.vn/product-p12533371.html?spid=12533372,Lão Tử
411,Khúc Thụy Du,https://tiki.vn/product-p2462905.html?spid=2469759,Du Tử Lê
412,Tuyển Tập Thơ Văn Hồ Chí Minh,https://tiki.vn/product-p924313.html?spid=10102403,Khánh Linh
413,Xuân Quỳnh - Thơ Và Đời,https://tiki.vn/product-p713954.html?spid=55282529,Xuân Quỳnh
414,Mẹ Xấu,https://tiki.vn/product-p581005.html?spid=581006,Sung Kyung Park
415,Sự Mất Ngủ Của Lửa (Tập Thơ),https://tiki.vn/product-p458365.html?spid=87494182,Nguyễn Quang Thiều
416,Thơ Tố Hữu (Tái Bản 2024),https://tiki.vn/product-p274839843.html?spid=274839844,Tố Hữu
417,Tủ Sách Văn Học Trong Nhà Trường - Thơ Trần Tế Xương,https://tiki.vn/product-p274726649.html?spid=274726650,Trần Tế Xương
418,Tục Ngữ Lược Giải (Tái Bản 2024),https://tiki.vn/product-p274579058.html?spid=274579059,Lê Văn Hòe
419,Thơ Xuân Diệu (Tái Bản 2023),https://tiki.vn/product-p273932126.html?spid=273932127,Xuân Diệu
420,Dưới Đáy Giếng Nhìn Lên,https://tiki.vn/product-p273662840.html?spid=273641104,Đáy Giếng
421,Vườn Tôi Có Cây Lá Bình Yên,https://tiki.vn/product-p271966496.html?spid=271966498,Winlinh
422,Sài Gòn Sót Mấy Con Ve,https://tiki.vn/product-p270747788.html?spid=270747791,"Trung Dũng KQĐ, Flowerliti"
423,Thơ Hay Viết Cho Thiếu Nhi - Bầu Trời Trong Quả Trứng (Tái Bản),https://tiki.vn/product-p262084700.html?spid=262084701,Xuân Quỳnh
424,Thơ Hay Viết Cho Thiếu Nhi: Dắt Mùa Thu Vào Phố,https://tiki.vn/product-p207841150.html?spid=207841151,Nguyễn Hoàng Sơn
425,Và Sao Không Thể Hết Yêu Em?,https://tiki.vn/product-p205941719.html?spid=205941721,Nhiều tác giả
426,Góc Sân Và Khoảng Trời (Thơ),https://tiki.vn/product-p180399933.html?spid=180399934,Trần Đăng Khoa
427,"Truyện Kiều (Trần Trọng Kim,Bùi Kỷ Hiệu Thảo) - Tái Bản",https://tiki.vn/product-p172175801.html?spid=172175802,Nguyễn Du
428,Hoàng Cầm 100 bài - Bìa mềm ,https://tiki.vn/product-p161957996.html?spid=161957997,Nguyễn Thụy Kha sưu tầm và biên soạn
429,(Thơ) KHÁT VỌNG ,https://tiki.vn/product-p160070067.html?spid=160070068,Hồ Xuân Đà
430,Rung Cảm Đầu Đời (Thơ - Sách Màu),https://tiki.vn/product-p155106681.html?spid=155106683,Bé Lê Quốc Triều (Minh Niệm)
431,Thơ Văn Nguyễn Đình Chiểu - Văn Học Trong Nhà Trường,https://tiki.vn/product-p125644210.html?spid=125644212,Nguyễn Đình Chiểu
432,Truyện Thúy Kiều - Đoạn Trường Tân Thanh (Tái Bản 2021),https://tiki.vn/product-p90117155.html?spid=90117156,"Nguyễn Du, Nguyễn Dữ, Nguyen Du, nguyen du"
433,Khi Chúng Ta Già,https://tiki.vn/product-p50579664.html?spid=52850059,Nguyễn Thị Việt Hà
434,Đào Uyên Minh Toàn Tập,https://tiki.vn/product-p4464929.html?spid=4464931,Đào Uyên Minh
435,Sách - Tiếng Việt ân tình - Thái Hà,https://tiki.vn/product-p274909408.html?spid=274909409,
436,Em Đang Giấu Gì Vậy? Cho Tôi Xem Được Không?,https://tiki.vn/product-p271972209.html?spid=271972211,Trịnh Nam Trân
437,Trời Này Quá Đẹp Để Buồn - Đời Này Quá Đẹp Lại Buồn,https://tiki.vn/product-p271005399.html?spid=271005402,Lê Hoài Đăng
438,Nhật Ký Trong Tù,https://tiki.vn/product-p253380957.html?spid=272402856,Hồ Chí Minh
439,Ký Mộng,https://tiki.vn/product-p185654117.html?spid=185654118,Nguyễn Du
440,Kim Vân Kiều (Bìa Giấy Dó Quét Điệp + Giấy Mỹ Thuật Cao Cấp + Tặng Kèm Phụ Bản Tranh),https://tiki.vn/product-p99089541.html?spid=99089542,Nguyễn Du
441,Cổ Vận Tân Phong - Tuyển Tập Thi Từ Chữ Hán Việt Nam Đương Đại,https://tiki.vn/product-p77721877.html?spid=77721878,Nhiều tác giả
442,Xứ - Rung Một Ngọn Mây,https://tiki.vn/product-p72332258.html?spid=72332259,Trần Lê Khánh
443,Hàn Mạc Tử - Thơ Và Đời,https://tiki.vn/product-p713988.html?spid=55282515,Hàn Mặc Tử
444,Vẫn Ơn Người Đến Giữa Trần Gian,https://tiki.vn/product-p274071090.html?spid=274071174,Winlinh
445,Sách - Góc Sân Và Khoảng Trời (Trần Đăng Khoa) - Sbooks,https://tiki.vn/product-p261988176.html?spid=261988177, Trần Đăng Khoa
446,"Nếu Như Tôi Nói Nhớ, Em Có Trở Về Không? - Tặng Kèm Bookmark + Postcard",https://tiki.vn/product-p215560903.html?spid=215560904,Nhiều tác giả
447,Không Sao Mà Chúng Ta Rồi Sẽ Ổn,https://tiki.vn/product-p203945332.html?spid=203945333,Mai Thanh Hạ
448,Hãy Yêu Đời Dẫu Đời Có Trái Ngang -Tặng kèm 01 Bookmark,https://tiki.vn/product-p186578985.html?spid=186578988,Mai Thanh Hạ
449,Thơ Hay Viết Cho Thiếu Nhi - Bài Ca Trái Đất,https://tiki.vn/product-p185006042.html?spid=185006043,Định Hải
450,Kim Vân Kiều Truyện,https://tiki.vn/product-p146270704.html?spid=146270705,Thanh Tâm Tài Nhân
451,Lãm Thúy Tập,https://tiki.vn/product-p72206702.html?spid=73491807,Nguyễn Bá Cung
452,Đại Nam Quốc Sử Diễn Ca,https://tiki.vn/product-p2345575.html?spid=2384675,"Lê Ngô Cát, Đặng Huy Trứ"
453,Cho Tôi Buồn Nốt Hôm Nay,https://tiki.vn/product-p270662674.html?spid=270662676,Khiếm Khuyết
454,Phùng Quán: Trăng Hoàng Cung,https://tiki.vn/product-p254083182.html?spid=254083183,Phùng Quán
455,111 Bài Thơ Đường Tuyển Chọn,https://tiki.vn/product-p199532582.html?spid=199532585,Lam Sơn
456,Những ngọn đèn thơm (Thơ thiếu nhi) - Hồ Huy Sơn,https://tiki.vn/product-p183700700.html?spid=183700701,Hồ Huy Sơn
457,Tục Ngữ - Ca Dao - Dân Ca Việt Nam 1 (Tái Bản 2021),https://tiki.vn/product-p146272319.html?spid=146272320,Vũ Ngọc Phan
458,Sách - Thơ Nguyễn Bính,https://tiki.vn/product-p113527842.html?spid=271288445,Nguyễn Bính
459,Ly Ca (Thơ),https://tiki.vn/product-p96750988.html?spid=96750990,Đỗ Doãn Phương
460,Văn Học Vết Thâm,https://tiki.vn/product-p78975612.html?spid=78975613,Nguyễn Thị Thúy Hạnh
461,Dưới Trăng Và Một Bậc Cửa - Thơ Dài Và Trường Ca (Tái bản 2020),https://tiki.vn/product-p55124651.html?spid=228595488,Nguyễn Quang Thiều
462,"Chúng Ta, Những Con Đường",https://tiki.vn/product-p19421103.html?spid=19421104,Du Tử Lê
463,Góc Sân Và Khoảng Trời (Tái Bản 2023),https://tiki.vn/product-p263703002.html?spid=263703003,Trần Đăng Khoa
464,Combo Thương Từ Thìa Đầy thơ - Và sao không thể hết yêu em?+ Thương_SKY,https://tiki.vn/product-p207642908.html?spid=207642909,
465,Hoàng Cầm Về Kinh Bắc - Ấn phẩm kỷ niệm 100 năm ngày sinh Hoàng Cầm,https://tiki.vn/product-p161247659.html?spid=161247660,Hoàng Cầm
466,Nhật Ký Trong Tù (Tái Bản),https://tiki.vn/product-p147341592.html?spid=147341593,Hồ Chí Minh
467,Đặng Đình Hưng Một Bến Lạ - Thơ Và Họa,https://tiki.vn/product-p146271373.html?spid=146271374,
468,Sách Tình Yêu Có Ở Muôn Nơi - Thơ Tình Bất Hủ Thế Giới,https://tiki.vn/product-p137250714.html?spid=137250715,.
469,Biển Là Trẻ Con - Thơ,https://tiki.vn/product-p57782435.html?spid=67040944,Huỳnh Mai Liên
470,Mai Kia Mốt Nọ Mình Rời Bỏ Người Ta,https://tiki.vn/product-p513017.html?spid=87494442,Ngô Nguyệt Hữu
471,Truyện Kiều (Tái Bản 2022),https://tiki.vn/product-p176752845.html?spid=176752850,Nguyễn Du
472,Gọi Em Bằng Tên Anh,https://tiki.vn/product-p171220176.html?spid=184075571,
473,Sự Thật Chính Là Sự Vui - Thơ,https://tiki.vn/product-p160671700.html?spid=160671701,Như Huy
474,Tập Văn Họa Kỷ Niệm Nguyễn Du,https://tiki.vn/product-p72206704.html?spid=73491712,Đào Duy Anh
475,Khắc Đi Khắc Đến - Hồi Ký,https://tiki.vn/product-p275832275.html?spid=275832276,Xuân Phương
476,Lòng Tôi Nhẹ Khi Mẹ Rời Xa,https://tiki.vn/product-p275218113.html?spid=275218114,Jennette McCurdy
477,TIỂU SỬ ELON MUSK,https://tiki.vn/product-p273383957.html?spid=273384043,Walter Isaacson
478,Nhà Tranh,https://tiki.vn/product-p272449822.html?spid=272449823,Ly Tran
479,Tôi Là Một Con Lừa,https://tiki.vn/product-p272112011.html?spid=272112012,Nguyễn Phương Mai
480,Tuyển tập Nam Cao,https://tiki.vn/product-p221230165.html?spid=221230167,Nam Cao
481,Sách chữa lành _ Hành trình bánh xe y học ,https://tiki.vn/product-p220669832.html?spid=220669833,
482,Tự Truyện Của Một Yogi,https://tiki.vn/product-p207841197.html?spid=207841198,Paramahansan Yogananda
483,Đi khi ta còn trẻ,https://tiki.vn/product-p196932335.html?spid=196932338,Trương Anh Ngọc
484,Một Kiểu Bình Thường Khác,https://tiki.vn/product-p195801675.html?spid=195801679,Abigail Balfe
485,Kí họa VENICE - Tác Giả Cuốn Sách Bán Chạy Nhất New York Times,https://tiki.vn/product-p193116255.html?spid=193116256,Rhys Bowen
486,Điệp Viên Hoàn Hảo X6 (Bìa Mềm),https://tiki.vn/product-p185909452.html?spid=185909453,Larry Berman
487,Điệp Viên Hoàn Hảo X6 (Bìa Cứng),https://tiki.vn/product-p185909442.html?spid=185909443,Larry Berman
488,Fryderyk Chopin: Cuộc Đời Và Thời Đại ,https://tiki.vn/product-p185188826.html?spid=186581380,
489,Thằng Huyện Con Hầu,https://tiki.vn/product-p183539219.html?spid=183539220,Văn Võ
490,Nhà Văn: Cuộc Đời Và Tác Phẩm,https://tiki.vn/product-p181699608.html?spid=181699611,DK
491,Chân Trần Chí Thép (Tái Bản 2022),https://tiki.vn/product-p181122317.html?spid=181122318,Jammes G Zumwalt
492,Châu Phi Nghìn Trùng (Tái Bản),https://tiki.vn/product-p174605333.html?spid=174605337,ISAK DINESEN
493,Beethoven - Nhà Soạn Nhạc Cổ Điển Vĩ Đại Thế Giới,https://tiki.vn/product-p167034118.html?spid=167034120,Rasmus Hoài Nam
494,Ăn Tối Cùng Chef Và Nói Chuyện Bếp,https://tiki.vn/product-p162025583.html?spid=162025584,Bếp Đơn
495,Sự Lựa Chọn - Nơi Ngục Tối Không Thể Ngăn Hi Vọng Nở Hoa,https://tiki.vn/product-p153521874.html?spid=153521875,Dr Edith Eva Eger
496,Tôi Đi Học - Nguyễn Ngọc Ký (Tái Bản),https://tiki.vn/product-p153518797.html?spid=153518798,Nguyễn Ngọc Ký
497,Miền Đất Hứa (A Promised Land) - Barack Obama (Bìa Cứng),https://tiki.vn/product-p152875147.html?spid=152875148,Barack Obama
498,Trắng,https://tiki.vn/product-p107026335.html?spid=107026336,Han Kang
499,Sách Putin Logic Của Quyền Lực (Tái Bản 2020),https://tiki.vn/product-p73222804.html?spid=73222805,Hubert Seipel
500,Khi Hơi Thở Hóa Thinh Không (Tái Bản 2020),https://tiki.vn/product-p55101289.html?spid=55101290,"Paul Kalanithi, Paul Kalanithi"
501,Đời Tổng Giám Mục PUGINIER,https://tiki.vn/product-p27611075.html?spid=70746070,Louis-Eugène Louvet
502,Từ Dụ Thái Hậu (2 Quyển Thượng + Quyển Hạ),https://tiki.vn/product-p14616755.html?spid=225914823,Trần Thùy Mai
503,Ngày đó có em,https://tiki.vn/product-p9734633.html?spid=9734634,Đinh Hùng
504,Quân Vương (Tái Bản),https://tiki.vn/product-p5914507.html?spid=20473212,Machiavelli
505,Plato Và Con Thú Mỏ Vịt Bước Vào Quán Bar (Tái Bản 2018 ),https://tiki.vn/product-p4255933.html?spid=4255935,Thomas Cathcart & Daniel Klein
506,Tự Truyện Benjamin Franklin (Tái Bản),https://tiki.vn/product-p3082815.html?spid=3083073,Benjamin Franklin
507,Người Tị Nạn,https://tiki.vn/product-p985825.html?spid=985827,Viet Thanh Nguyen
508,Khi Hơi Thở Hóa Thinh Không,https://tiki.vn/product-p750578.html?spid=750581,Paul Kalanithi
509,Tôi Học Đại Học - Nguyễn Ngọc Ký	 (Tái Bản),https://tiki.vn/product-p532669.html?spid=253589,Nguyễn Ngọc Ký
510,Lũy hoa,https://tiki.vn/product-p276376942.html?spid=276376945,Nguyễn Huy Tưởng
511,Britney Spears - Người Đàn Bà Trong Tôi,https://tiki.vn/product-p274721707.html?spid=274721708,Britney Spears
512,"VIẾT LẠI MÃ SỰ SỐNG - Jennifer Doudna, chỉnh sửa gen và tương lai loài người",https://tiki.vn/product-p273383954.html?spid=273383955,Walter Isaacson
513,Hội hè miên man,https://tiki.vn/product-p272000020.html?spid=272000022,Ernest Hemingway
514,Cánh Cổng,https://tiki.vn/product-p270744932.html?spid=270744933,Natsume Soseki
515,Tuyển tập Ngô Tất Tố,https://tiki.vn/product-p221230184.html?spid=221230187,Ngô Tất Tố
516,Chìm nổi giữa Paris và London,https://tiki.vn/product-p209332786.html?spid=209332787,George Orwell
517,Điệp Viên Hoàn Hảo X6 - Phạm Xuân Ẩn,https://tiki.vn/product-p192948869.html?spid=192948870,Larry Berman
518,Bùi Kiến Thành - Người Mở Khóa Lãng Du (Hồi Ký),https://tiki.vn/product-p192377682.html?spid=192377683,"Lê Xuân Khoa, Thanh Huyền, Xuân Chi"
519,Chuyện Đời Tôi,https://tiki.vn/product-p174605357.html?spid=174605358,Hans Christian Andersen
520,Vương Hồng Sển - Chuyện Cũ Ở Sốc-Trăng - Di Cảo - Tập 2,https://tiki.vn/product-p170352285.html?spid=170352298,Vương Hồng Sển
521,Giữa Hai Vương Quốc,https://tiki.vn/product-p163928967.html?spid=163928968,Suleika Jaouad
522,Combo Lính Bay ( Trọn Bộ 2 Cuốn ) - Sổ Tay,https://tiki.vn/product-p148940423.html?spid=148940424,
523,Người Thầy (Hồi Ức Của Một Nhà Giáo Mỹ),https://tiki.vn/product-p120219392.html?spid=120219393,Frank McCourt
524,Leonardo da Vinci: Cuộc Đời Và Tác Phẩm Qua 500 Hình Ảnh,https://tiki.vn/product-p115438369.html?spid=115958625,Rosalind Miles
525,CĂN NHÀ AN ĐÔNG CỦA MẸ TÔI,https://tiki.vn/product-p78014812.html?spid=78014813,Nguyễn Tường Thiết
526,Hãy Gọi Tên Tôi (Hồi Ký),https://tiki.vn/product-p58063566.html?spid=58390406,Chanel Miller
527,Chuyện Đời Xưa Của Trương Vĩnh Ký – Người Giữ Lửa Cho Tiếng Việt Miền Nam,https://tiki.vn/product-p54432859.html?spid=54432860,Trương Vĩnh Ký
528,Từ Kiến Trúc Sư Thành Bác Sĩ Tại Hoa Kỳ,https://tiki.vn/product-p35010878.html?spid=94147961,Huỳnh Wynn Trần
529,Từ Dụ Thái Hậu - Quyển Hạ,https://tiki.vn/product-p14616761.html?spid=14616762,Trần Thùy Mai
530,"Trịnh Công Sơn - Tôi Là Ai, Là Ai (Tái Bản)",https://tiki.vn/product-p5995381.html?spid=5995383,Nhiều tác giả
531,Tuổi Trẻ Không Hối Tiếc,https://tiki.vn/product-p2224869.html?spid=92784823,Huyền Chip
532,Bác Hồ Kể Chuyện Tây Du Ký (Tái Bản),https://tiki.vn/product-p653825.html?spid=653863,Trần Văn Giang
533,Trạm Đọc | Một Người Việt Trầm Lặng : Phạm Xuân Ẩn - Điệp Viên Thách Thức Nước Mỹ,https://tiki.vn/product-p273471483.html?spid=274900942,Jean-Claude Pomonti
534,SÁCH - Kiểm soát sự tập trung giữa cơn bão công nghệ - Tác giả Johann Hari,https://tiki.vn/product-p273094693.html?spid=273094694,Johann Hari
535,Tuyển Tập Nguyễn Công Hoan,https://tiki.vn/product-p271798385.html?spid=271798386,Nguyễn Công Hoan
536,Hồi Ký Tiến Sĩ Lê Thẩm Dương,https://tiki.vn/product-p270702712.html?spid=270702713,Lê Thẩm Dương
537,Sách Ông Tướng Tình Báo Bí Ẩn Và Những Điệp Vụ Siêu Hạng,https://tiki.vn/product-p251772507.html?spid=251772508,Hoàng Hải Vân
538,Tuyển tập Vũ Trọng Phụng,https://tiki.vn/product-p221230178.html?spid=221230179,Vũ Trọng Phụng
539,Tây Sơn Phụng Thần Ký,https://tiki.vn/product-p219164822.html?spid=219164823,Thành Châu
540,Gánh gánh… gồng gồng… (Xuân Phượng hồi ký),https://tiki.vn/product-p207035097.html?spid=207299332,Nguyễn Thị Xuân Phượng
541,Barca - Lionel Messi Và Sự Thăng Trầm Của Câu Lạc Bộ Bóng Đá Vĩ Đại Nhất Thế Giới,https://tiki.vn/product-p205986062.html?spid=205986064,Simon Kuper
542,Những Lời Hứa Phải Giữ - Cuộc Đời Và Sự Nghiệp Chính Trị Của Tôi,https://tiki.vn/product-p195960775.html?spid=195960777,Joe Biden
543,Vương Hồng Sển - Tạp Bút Năm Giáp Tuất 1994 - Di Cảo,https://tiki.vn/product-p186286194.html?spid=186286195,Vương Hồng Sển
544,Kinh Tế Nhật Bản: Giai Đoạn Phát Triển Thần Kỳ 1955-1973,https://tiki.vn/product-p180399888.html?spid=180399889,Trần Văn Thọ
545,Những dấu chân Thiền sư,https://tiki.vn/product-p179531182.html?spid=179531183,Thích Nữ Chân Không
546,Bảy Kiểu Người Tôi Gặp Trong Hiệu Sách - Cuốn Tự Truyện Của Chủ Hiệu Sách Đặc Sắc Và Thú Vị Nhất Thế Giới,https://tiki.vn/product-p146065917.html?spid=146065918,Shaun Bythell
547,Hồi ký về gia đình Nguyễn Tường,https://tiki.vn/product-p143171426.html?spid=143171427,
548,Sách Ký Ức Đông Dương,https://tiki.vn/product-p137133506.html?spid=137133507,Tô Hoài
549,Sách Trong Phòng Chờ Với Bác Sĩ Wynn,https://tiki.vn/product-p136482573.html?spid=198731687,
550,Titan - Gia Tộc Rockefeller (Tái Bản 2020),https://tiki.vn/product-p75376744.html?spid=98589464,Ron Chernow
551,Điệp Viên Hoàn Hảo X6 - Bìa cứng (Tái bản),https://tiki.vn/product-p57510013.html?spid=85185497,Larry Berman
552,Nhất Linh Cha Tôi,https://tiki.vn/product-p57117716.html?spid=57117717,
553,Những Người Bạn Cố Đô Huế (Tập III - 1916),https://tiki.vn/product-p1709229.html?spid=1709249,B.A.V.H
554,Combo Gánh gánh... Gồng gồng - Khắc đi... Khắc đến (Hồi ký Xuân Phượng),https://tiki.vn/product-p275925318.html?spid=276396655,Xuân Phượng
555,Gã hề Chicot,https://tiki.vn/product-p275926326.html?spid=275926328,Harriet Beecher Stowe
556,25 Độ Âm,https://tiki.vn/product-p275613236.html?spid=275613239,Thảo Trang
557,Bác Hana,https://tiki.vn/product-p273356637.html?spid=273356638,Alena Mornštajnová
558,Hai số phận (bìa mềm),https://tiki.vn/product-p249875150.html?spid=249875152,Jeffrey Archer
559,Dưới Cánh Cửa Thầm Thì,https://tiki.vn/product-p249160355.html?spid=249160357,TJ Klune
560,Người nuôi ong thành Aleppo - The beekeeper of Aleppo (Aspen Words Literary Prize Winner),https://tiki.vn/product-p196150482.html?spid=196150483,Christy Lefteri
561,Của Chuột Và Người,https://tiki.vn/product-p190707619.html?spid=190707623,John Steinbeck
562,Siddhartha,https://tiki.vn/product-p190702862.html?spid=190702865,Hermann Hesse
563,"Cutie Pie – Em Ngoan, Lại Cho Là Em Ngốc",https://tiki.vn/product-p184801142.html?spid=184801147,Bambam
564,Tìm Lại Màu Xanh (Phần Tiếp Theo Của Người Truyền Ký Ức),https://tiki.vn/product-p178514167.html?spid=178514168,Lois Lowry
565,Ngôi Nhà Bên Bờ Biển Xanh Thẳm,https://tiki.vn/product-p176909221.html?spid=176909223,T.J.Klune
566,Bản Đồ Các Ngày,https://tiki.vn/product-p148802194.html?spid=148802199,Ransom Riggs
567,Một Thoáng Ta Rực Rỡ Ở Nhân Gian,https://tiki.vn/product-p147920903.html?spid=147920904,Ocean Vuong
568,Kiêu Hãnh Và Định Kiến (Tái Bản),https://tiki.vn/product-p127844385.html?spid=127844386,Jane Austen
569,Người Tình Sputnik,https://tiki.vn/product-p116397449.html?spid=116397451,Haruki Murakami
570,Rừng Nauy (Tái Bản),https://tiki.vn/product-p114937969.html?spid=114937971,Haruki Murakami
571,Nếu Em Không Phải Giấc Mơ (Tái Bản),https://tiki.vn/product-p113530804.html?spid=113530806,Marc Levy
572,Tàn Ngày Để Lại (Bìa Cứng),https://tiki.vn/product-p77105730.html?spid=77105731,Kazuo Ishiguro
573,Combo Bộ 2 Cuốn: Giết Chỉ Huy Đội Kỵ Sĩ (Tập 1: Ý Tưởng Xuất Hiện + Tập 2: Ẩn Dụ Dịch Chuyển),https://tiki.vn/product-p76305752.html?spid=76305753,Haruki Murakami
574,Cuộc Đời Là Một Tiểu Thuyết,https://tiki.vn/product-p76012203.html?spid=76012204,Guillaume Musso
575,Cây Cam Ngọt Của Tôi,https://tiki.vn/product-p74021317.html?spid=74021318,José Mauro de Vasconcelos
576,Hoa Vẫn Nở Mỗi Ngày,https://tiki.vn/product-p72308265.html?spid=72308266,Valérie Perrin
577,Con Chim Xanh Biếc Bay Về (Nguyễn Nhật Ánh) (Bìa Mềm),https://tiki.vn/product-p72202103.html?spid=72102027,Nguyễn Nhật Ánh
578,Trường Ca Achilles (Quà Tặng Kèm: 01 Bookmark + 01 Phụ Lục),https://tiki.vn/product-p56609155.html?spid=56609156,Madeline Miller
579,Chiến Binh Cầu Vồng (Tái Bản 2020),https://tiki.vn/product-p52788072.html?spid=52788073,Andrea Hirata
580,Biên Niên Ký Chim Vặn Dây Cót (Tái Bản 2020),https://tiki.vn/product-p52329765.html?spid=52329767,Haruki Murakami
581,Kafka bên bờ biển (Tái Bản 2020),https://tiki.vn/product-p52329763.html?spid=52329766,Haruki Murakami
582,21 Bài Học Cho Thế Kỷ 21,https://tiki.vn/product-p35191892.html?spid=35191894,Yuval Noah Harari
583,Khu Vườn Bí Mật ( Tái Bản 2019 ),https://tiki.vn/product-p14684952.html?spid=14684953,Frances Hodgson Burnett
584,Sự Cứu Rỗi Của Thánh Nữ,https://tiki.vn/product-p14053724.html?spid=14053725,Higashino Keigo
585,Bố Con Cá Gai (Tái Bản 2019),https://tiki.vn/product-p12377498.html?spid=12377499,Cho Chang - In
586,Suối Nguồn (Tái Bản),https://tiki.vn/product-p7982628.html?spid=7982629,Ayn Rand
587,Lâu Đài Trên Mây,https://tiki.vn/product-p7440075.html?spid=7440077,Diana Wynne Jones
588,Nhật Ký Anne Frank (Tái Bản),https://tiki.vn/product-p5067155.html?spid=5411129,Anne Frank
589,Người Đua Diều (Tái Bản 2018),https://tiki.vn/product-p4780917.html?spid=4781791,Khaled Hosseini
590,Dưới Một Mái Nhà Ở Paris,https://tiki.vn/product-p1445365.html?spid=1449791,Guillaume Musso
591,Có Hai Con Mèo Ngồi Bên Cửa Sổ,https://tiki.vn/product-p347334.html?spid=39001,Nguyễn Nhật Ánh
592,Ngôi Nhà Rô Bốt Trong Rừng Sâu,https://tiki.vn/product-p276353075.html?spid=276353076,TJ.Klune
593,Những yêu nữ xứ Titan,https://tiki.vn/product-p276280444.html?spid=276280445,Kurt Vonnegut
594,Cánh cửa mở rộng. Núi thần Tập 1+2,https://tiki.vn/product-p275962493.html?spid=275965229,Thomas Mann
595,Nhà ảo thuật trên cây cầu bộ hành,https://tiki.vn/product-p275945039.html?spid=275945042,Wu Minh-Yi
596,Vải tiến Trường An,https://tiki.vn/product-p275278631.html?spid=275278632,Mã Bá Dung
597,Từ giờ thứ sáu đến giờ thứ chín (Tái bản bổ sung 2024),https://tiki.vn/product-p275212153.html?spid=275212154,Nguyễn Một
598,Những chuyện lạ ở Tokyo,https://tiki.vn/product-p273691873.html?spid=273691876,Haruki Murakami
599,Emma - Jane Austen - Tiểu Thuyết,https://tiki.vn/product-p221229959.html?spid=221229960,Jane Austen
600,Sông Đông Êm Đềm (Trọn Bộ 2 Tập),https://tiki.vn/product-p202661687.html?spid=202661688,Mikhail Sholokhov
601,Bách hóa giấc mơ của ngài Dollargut,https://tiki.vn/product-p197587865.html?spid=197587866,Lee Miye
602,Hiệu Sách Cuối Cùng Ở London - Tiểu Thuyết Về Chiến Tranh Thế Giới Thứ Hai - Cuốn Sách Bán Chạy Nhất New York Times,https://tiki.vn/product-p196382820.html?spid=196382821,Madeline Martin
603,"Bá tước Monte-Cristo, trọn bộ 3 tập",https://tiki.vn/product-p196150464.html?spid=196150467,Alexandre Dumas
604,Dây oan    ,https://tiki.vn/product-p192876289.html?spid=192876290,Hồ Biểu Chánh
605,Trăng Khi Tròn Khi Khuyết,https://tiki.vn/product-p190738015.html?spid=190738017,Shogo Sato
606,Đường Hầm,https://tiki.vn/product-p176909240.html?spid=176909241,So Jae Won
607,Khải Huyền Muộn,https://tiki.vn/product-p174606930.html?spid=174606931,Nguyễn Việt Hà
608,Định Mệnh Dưới Mưa,https://tiki.vn/product-p173481350.html?spid=173481353,Khang Thành
609,Đợi Khi Tôi Có Tội (Bộ 3 Tập),https://tiki.vn/product-p152464642.html?spid=152464643,Đinh Mặc
610,Chuyện Con Chó Tên Là Trung Thành,https://tiki.vn/product-p146274565.html?spid=146274566,Luis Sepulveda
611,Cô Bé Nhìn Mưa,https://tiki.vn/product-p129748827.html?spid=129748828,Đặng Thị Hạnh
612,Và Rồi Núi Vọng,https://tiki.vn/product-p121185870.html?spid=121185873,Khaled Hosseini
613,Xa Ngoài Kia Nơi Loài Tôm Hát - Where The Crawdads Sing,https://tiki.vn/product-p73207240.html?spid=73523598,Delia Owens
614,Thợ Xăm Ở Auschwitz,https://tiki.vn/product-p69764534.html?spid=69764536,Heather Morris
615,Những Con Chim Ẩn Mình Chờ Chết (Tái Bản 2020),https://tiki.vn/product-p57354850.html?spid=57354851,Colleen Mccullough
616,Hiệu Sách Nhỏ Ở Paris,https://tiki.vn/product-p56454897.html?spid=56454898,Nina George
617,Hồ Sơ Rachel,https://tiki.vn/product-p56362836.html?spid=56362837,Martin Amis
618,Khi Lỗi Thuộc Về Những Vì Sao (Tái Bản),https://tiki.vn/product-p48629558.html?spid=48629560,John Green
619,Đẹp Và Buồn,https://tiki.vn/product-p27594632.html?spid=27594633,Kawabata Yasunari
620,Đối Thoại Với Thượng Đế ( Tái Bản ),https://tiki.vn/product-p20520720.html?spid=20520721,Neale Donald Walsch
621,Nhóc Nicolas: Những Chuyện Chưa Kể Tập 3 (Tái Bản 2019),https://tiki.vn/product-p15913448.html?spid=15913449,"Sempé, Goscinny"
