book_id,name,link,authors
0,Walden Một Mình Sống Trong Rừng (Ấn Bản Bỏ Túi) - Bản Quyền,https://tiki.vn/product-p275861063.html?spid=275861064,Henry David Thoreau
1,Du Ký Việt Nam trên Nam Phong tạp chí (Hộp 2 cuốn),https://tiki.vn/product-p274468056.html?spid=274540893,"Nguyễn Hữu Sơn, Nhiều tác giả"
2,Vạn Dặm Đường Từ Một Bước Chân,https://tiki.vn/product-p273842947.html?spid=273842948,Mavis ViVu Ký
3,Du hành cùng Herodotus,https://tiki.vn/product-p210277405.html?spid=210277409,Ryszard Kapuściński
4,Gỗ mun,https://tiki.vn/product-p210277378.html?spid=210277384,Ryszard Kapuściński
5,1111 - Nhật Ký Sáu Vạn Dặm Trên Yên Xe Cà Tàng,https://tiki.vn/product-p204317934.html?spid=226923791,Trần Đặng Đăng Khoa
6,Cơm nhà xứ Quảng (Tặng kèm 1 bộ postcard 6 tấm có gửi hình kèm theo),https://tiki.vn/product-p196902142.html?spid=196902144,Lưu Bình
7,Con Đường Tơ Lụa - Vạn Dặm Xa Từ Pakistan Tới Tây An,https://tiki.vn/product-p193209826.html?spid=193209828,Trần Hồng Ngọc
8,Du Ký Phan Quang - Tiếc Nuối Hoa Hồng,https://tiki.vn/product-p192333128.html?spid=192333129,Phan Quang
9,Con Đường Tơ Lụa,https://tiki.vn/product-p189588167.html?spid=189588168,Trần Hồng Ngọc
10,Ngón Tay Mình Còn Thơm Mùi Oải Hương (Tái Bản Có Cập Nhật Chỉnh Sửa),https://tiki.vn/product-p135552449.html?spid=135552450,Ngô Thị Giáng Uyên
11,Sự Thật Ta Nắm Giữ - Một Hành Trình Xuyên Nước Mỹ,https://tiki.vn/product-p109982962.html?spid=109982963,Kamala Harris
12,Tinh Hoa Du Ký Trên Tri Tân Tạp Chí (1941-1945),https://tiki.vn/product-p103511951.html?spid=103511952,"Nguyễn Hữu Sơn, Trần Bá Dung"
13,Cô Đơn Trên Everest (Du Ký),https://tiki.vn/product-p76106026.html?spid=76262768,Di Li
14,Tây Tạng Huyền Bí & Nghệ Thuật Sinh Tử (Tái Bản 2020),https://tiki.vn/product-p53545646.html?spid=53545647,Đặng Hoàng Xa
15,Đi Thật Xa Trên Một Chiếc Camper,https://tiki.vn/product-p33765288.html?spid=33765289,
16,Đừng Chết Ở Ả Rập Xê Út,https://tiki.vn/product-p26412706.html?spid=26412707,Nghiêm Hương
17,Thế Giới Rộng Lớn Đừng Đi Một Mình,https://tiki.vn/product-p17406542.html?spid=17406543,Lý Thành Cơ
18,Theo Chân Người Tình & Một Mảnh Tình Riêng,https://tiki.vn/product-p4059697.html?spid=4060657,Sơn Nam
19,Mùi Hương Trầm,https://tiki.vn/product-p3767321.html?spid=3767323,Nguyễn Tường Bách
20,Đạp Xe Vì Tình Từ Ấn Sang Âu,https://tiki.vn/product-p1061576.html?spid=20478987,Per J Andersson
21,Bước Chân Theo Dấu Mặt Trời – Hành Trình Trở Về Ấn Độ,https://tiki.vn/product-p1058052.html?spid=1045288,Phương Thu Thủy
22,Xách Ba Lô Lên Và Đi - Tập 1: Châu Á Là Nhà. Đừng Khóc! (Tái Bản),https://tiki.vn/product-p387725.html?spid=88100,Huyền Chip
23,"Châu Âu Vạn Dặm - Một Cuộc Đời Sống, Vạn Bước Chân Đi",https://tiki.vn/product-p276016577.html?spid=276016578,
24,Tôi Là Một Con Lừa -  Nguyễn Phương Mai - (bìa mềm),https://tiki.vn/product-p272198973.html?spid=272963954,Nguyễn Phương Mai
25,Tung Tăng Tung Tẩy…Trời Tây (Tái Bản T9/2022),https://tiki.vn/product-p249941178.html?spid=249941179,Lưu Đình Triều
26,"Đà Lạt, một thời hương xa - Du Khảo Văn Hóa Đà Lạt 1954 - 1975",https://tiki.vn/product-p194960746.html?spid=194960747,Nguyễn Vĩnh Nguyên
27,Sách Từ Rừng Thẳm Amazon Đến Quê Hương Bolero,https://tiki.vn/product-p181991026.html?spid=181991027,Nguyễn Tập
28,"Tiếp Viên Hàng Không - Đôi Chân, Trái Tim Và Bầu Trời",https://tiki.vn/product-p167462132.html?spid=167462133,
29,Tiếp viên hàng không - Đôi chân trái tim và bầu trời,https://tiki.vn/product-p164209952.html?spid=164209953,
30,Việt Nam Dọc Miền Du Ký - Tập 2,https://tiki.vn/product-p162399299.html?spid=162399300,
31,UZBEKISTAN - Giấc Mơ Màu Lam Ngọc,https://tiki.vn/product-p136013292.html?spid=270111597,
32,Tôi Nghĩ Tôi Thích Nước Mỹ - Du Ký (Dương Thụy) (Tái Bản),https://tiki.vn/product-p111582626.html?spid=111582628,Dương Thụy
33,Joe Biden - Hành Trình Kéo Dài Năm Thập Kỷ,https://tiki.vn/product-p95163489.html?spid=95163490,
34,Chu Du Xứ Sương Mù,https://tiki.vn/product-p72882541.html?spid=73300796,Kim Anh
35,Vắt Qua Những Ngàn Mây,https://tiki.vn/product-p23870341.html?spid=23870342,Đỗ Quang Tuấn Hoàng
36,Đi Bộ Xuyên Việt Với Cây Đàn Guitar,https://tiki.vn/product-p15592528.html?spid=15592531,Hồ Nhật Hà
37,Du Ngoạn Vòng Quanh Châu Á Trên Lưng Ngựa,https://tiki.vn/product-p11491784.html?spid=11491785,
38,Đi Rong Trên Những Múi Giờ,https://tiki.vn/product-p8011013.html?spid=8011014,Nguyễn Hữu Tài
39,Trên Đường Về Nhớ Đầy (Du Ký),https://tiki.vn/product-p5995385.html?spid=5995387,Dương Thành Truyền
40,Du Hành Ký - Cuộc Sống & Những Điều Kì Diệu,https://tiki.vn/product-p507422.html?spid=586100,.
41,Rong Ruổi Thực Lục - Tập 1,https://tiki.vn/product-p370916.html?spid=153907102,Trần Đức Anh Sơn
42,Vạn Dặm Đường Từ Một Bước Chân - Tặng Kèm Bookmark,https://tiki.vn/product-p273916343.html?spid=273916344,Mavis ViVu Ký
43,Từ Nhà Ra Thế Giới - Những Bước Chân Đầu Tiên Của Một Công Dân Toàn Cầu,https://tiki.vn/product-p71353257.html?spid=71353258,Nhiều tác giả
44,Combo Sách Du Ký : HIMALAYA – Hành Trình Chạm Đến Trán Trời + Khơi Lửa Sông Nile + Đừng Chết Ở Ả Rập Xê Út,https://tiki.vn/product-p54426455.html?spid=89920170, Nhiều Tác Giả
45,HIMALAYA –  Hành Trình Chạm Đến Trán Trời,https://tiki.vn/product-p48481757.html?spid=48481758,Mai Lan
46,Du Ký Xanh - Hành Trình Cứu Biển,https://tiki.vn/product-p41294584.html?spid=41294585,Lekima Hùng
47,Ở Lại Với Ngàn Sao (Du Ký),https://tiki.vn/product-p14660324.html?spid=87497438,Đỗ Doãn Hoàng
48,Trên Đỉnh Namsan Ngắm Mặt Trời,https://tiki.vn/product-p5745743.html?spid=5745745,Hoài Thanh
49,Từ Rừng Thẳm Amazon Đến Quê Hương Bolero,https://tiki.vn/product-p644149.html?spid=24825210,Nguyễn Tập
50,Tây Tạng Huyền Bí Và Nghệ Thuật Sinh Tử - Đặng Hoàng Xa (Omega),https://tiki.vn/product-p275466963.html?spid=72187247,Đặng Hoàng Xa
51,Mèo Mốc - Nào Ta Cùng Ăn,https://tiki.vn/product-p210760848.html?spid=210760849,Mèo Mốc
52,Combo 3 cuốn Du ký Việt (Con đường - Dành cả - Tiếp viên),https://tiki.vn/product-p190230191.html?spid=190230192,"Hồng Trân, Trần Hồng Ngọc,  Phương Vũ"
53,Đà Lạt Bên Dưới Sương Mù,https://tiki.vn/product-p10190801.html?spid=20481144,Nguyễn Vĩnh Nguyên
54,Thiên Đường Qua Những Ô Cửa Màu Xanh,https://tiki.vn/product-p4708867.html?spid=32220118,Na Hồ
55,Đá Nhọn Vực Sâu,https://tiki.vn/product-p1256325.html?spid=20480645,Nguyễn Vân Anh.
56,Sơn Nam - Vạch Một Chân Trời - Chim Quyên Xuống Đất,https://tiki.vn/product-p68819776.html?spid=68819777,Sơn Nam
57,Vàng Son Một Thuở Ba Tư - Tập Du Ký,https://tiki.vn/product-p50379011.html?spid=50723974,Nguyễn Chí Linh
58,Namaskar! Xin Chào Ấn Độ (Tái Bản 2020),https://tiki.vn/product-p50214757.html?spid=50214758,Hồ Anh Thái
59,Nước Mỹ Lại Đi Và Viết,https://tiki.vn/product-p34957241.html?spid=39358386,Phạm Nguyễn Linh Đan
60,Bước Chân Theo Dấu Mặt Trời – Hành Trình Trở Về Ấn Độ (Bản Thông Thường)(Tặng Kèm Bookmark Tiki),https://tiki.vn/product-p22367423.html?spid=59005374,Phương Thu Thủy
61,Những Miền Lưu Dấu - Cảnh Việt Trong Văn Chương,https://tiki.vn/product-p225267771.html?spid=225267773,Nhiều tác giả
62,Nửa Vòng Trái Đất Uống Một Ly Trà,https://tiki.vn/product-p36061937.html?spid=37794416,Di Li
63,Những bí ẩn trên thế giới chưa được giải đáp (Bìa cứng) - Tái bản,https://tiki.vn/product-p270442383.html?spid=270442386,Nguyễn Văn Huân
64, Tuyển Tập Du Ký( Tặng kèm sổ tay),https://tiki.vn/product-p174180289.html?spid=174180290,
65,Voi Không Ngà,https://tiki.vn/product-p27597754.html?spid=27597755,Phan Việt Lâm
66,Thế Giới Rộng Lớn Đừng Đi Một Mình - Tặng Kèm Bookmark + Postcard,https://tiki.vn/product-p274684657.html?spid=274684658,Lý Thành Cơ
67,Cô Đơn Trên Everest (Tái bản 2022),https://tiki.vn/product-p225170585.html?spid=225170586," Di Li, Di Li"
68,"Vòng Quanh Châu Á – Nam Kỳ, Trung Kỳ, Bắc Kỳ",https://tiki.vn/product-p275853507.html?spid=275853511,Jean Marie Albert Marcel Monnier
69,Về Nơi Có Nhiều Cánh Đồng (Tái Bản 2023),https://tiki.vn/product-p270253544.html?spid=270253545,Phan
70,Tung tăng tung tẩy…trời Tây (Tái bản T9/2022),https://tiki.vn/product-p198643637.html?spid=198643638,Lưu Đình Triều
71,Chốc Lát Những Bến Bờ,https://tiki.vn/product-p14523892.html?spid=24825016,Hồ Anh Thái
72,Đường Xa Nắng Mới - Nguyễn Tường Bách,https://tiki.vn/product-p275006253.html?spid=275006254,Nguyễn Tường Bách
73,Sách Những bố già châu Á (Tái bản Mới Nhất) - Alphabooks - BẢN QUYỀN,https://tiki.vn/product-p208648538.html?spid=263024813,
74,Triệu Dấu Chân Qua Những Cửa Ô,https://tiki.vn/product-p202961583.html?spid=202961584,Nguyễn Trương Quý
75,"Sách Jane Eyre bìa cứng, tặng kèm bookmark Volnyy, tiểu thuyết văn học kinh điển Charlotte Bronte",https://tiki.vn/product-p276585178.html?spid=276585179,Charlotte Bronte
76,Vì Con Gái Tôi Có Thể Đánh Bại Cả Ma Vương - Tập 8,https://tiki.vn/product-p276545380.html?spid=276546656,CHIROLU
77,[Light Novel] Dược Sư Tự Sự - Tập 5 - Tặng Kèm Bookmark + Sổ Xé,https://tiki.vn/product-p276248033.html?spid=276248034,Natsu Hyuuga
78,Thần Chết Làm Thêm 300 Yên/Giờ (Tái bản),https://tiki.vn/product-p249157120.html?spid=249157122,Fujimaru
79,Tập Tỏ Tình - 1,https://tiki.vn/product-p195969662.html?spid=195969667,"HoneyWorks, Fujitani Toko"
80,Dược Sư Tự Sự (Light-novel) - Tập 2 - Tặng Kèm Bookmark + Postcard Có Chân Đế,https://tiki.vn/product-p195696308.html?spid=195696309,Natsu Hyuuga
81,Kỳ Nghỉ Dưỡng Của Chàng Quý Tộc Ôn Hòa (Tập 3),https://tiki.vn/product-p195291853.html?spid=195291855,Misaki
82,[Light Novel] Hiệp Sĩ Lưu Ban – Tập 11,https://tiki.vn/product-p194788201.html?spid=194788203,Riku Misora
83,Liệu Có Sai Lầm Khi Tìm Kiếm Cuộc Gặp Gỡ Định Mệnh Trong Dungeon - Tập 9 - Bản Giới Hạn - Tặng Kèm Bookmark + Postcard PVC,https://tiki.vn/product-p193976637.html?spid=193976638,"Fujino Omori,  Suzuhito Yasuda"
84,Hành Trình Của Elaina - Tập 11 - Tặng Kèm 03 Bookmark Bế Hình Nhân Vật + 1 Postcard,https://tiki.vn/product-p193736648.html?spid=193736649,Jougi Shiraishi
85,Hội Chứng Tuổi Thanh Xuân - Tập 7 - Bản Giới Hạn - Tặng Kèm Bookmark + Postcard,https://tiki.vn/product-p192949714.html?spid=192949715,"Hajime KAMOSHIDA,  Keji MIZOGUCHI"
86,Thám Tử Đã Chết Tập 4,https://tiki.vn/product-p187859733.html?spid=187859737,Nigozyu
87,Spy Room – Lớp Học Điệp Viên 4,https://tiki.vn/product-p187859732.html?spid=187859736,Nigozyu
88,Gửi Tới Người Mùa Đông Này Sẽ Không Còn Nữa,https://tiki.vn/product-p187827390.html?spid=187827391,Inujun
89,Sakurako Và Bộ Xương Dưới Gốc Anh Đào - Tập 10,https://tiki.vn/product-p179546685.html?spid=179546689,Shiori Ota
90,Vì Con Gái Tôi Có Thể Đánh Bại Cả Ma Vương - Tập 5 - Tặng Kèm Poster + Bookmark,https://tiki.vn/product-p172422019.html?spid=172422020,CHIROLU
91,Thám Tử Đã Chết - Tập 1 - Tặng Kèm Bookmark Tròn,https://tiki.vn/product-p172421994.html?spid=172421995,Nigozyu
92,Holmes Ở Kyoto – Tập 5 [Tặng Kèm Postcard],https://tiki.vn/product-p172175727.html?spid=172175730,Mai Mochizuki
93,"Bị Đuổi Khỏi Nhóm Anh Hùng, Tôi Muốn Sống Tự Do Tự Tại Ở Vương Đô, Tập 3",https://tiki.vn/product-p167114300.html?spid=167114304,Kiki
94,Hội Chứng Tuổi Thanh Xuân - Tập 5,https://tiki.vn/product-p149778990.html?spid=149778991,"Hajime KAMOSHIDA,  Keji MIZOGUCHI"
95,Chuyển Sinh Làm Người Sói Tôi Trở Thành Cánh Tay Phải Của Ma Vương  (Tập 3) ,https://tiki.vn/product-p146272042.html?spid=146272044, Nishi(E)da
96,Thám Tử Đã Chết - Tập 1 (Tặng Kèm Bookmark Tròn),https://tiki.vn/product-p119224744.html?spid=120476190,Nigozyu
97,Người Phá Vỡ Chứng Cứ Ngoại Phạm,https://tiki.vn/product-p103284764.html?spid=103284765,Seiichiro Oyama
98,Hoàng Tử Thiên Tài - Hành Trình Gây Dựng Lại Đất Nước Đang Lâm Nguy  - Tập 1,https://tiki.vn/product-p87726602.html?spid=87726604,Toru Toba
99,Nhà Trọ Chim Hoàng Yến - Đôi Cánh Hướng Tới Những Vì Sao [Tặng Kèm: 01 Postcard (9 x 15 cm)+ 01 Bookmark],https://tiki.vn/product-p86517369.html?spid=88809358,Saki Murayama
100,Sakurako Và Bộ Xương Dưới Gốc Anh Đào 7 - Những Ngón Tay Biết Kể Chuyện,https://tiki.vn/product-p80142814.html?spid=80142816,Shiori Ota
101,Ẩn Tàng Thư Dantalian - Tập 6,https://tiki.vn/product-p72027655.html?spid=72027657,Mikumo Gakuto
102,Sói Và Gia Vị (Tập 13),https://tiki.vn/product-p49305974.html?spid=49305975,Hasekura Isuna
103,Gia Tộc Thần Bí - Tập 2 (Tặng Kèm 3 Bookmark Ivory),https://tiki.vn/product-p46327372.html?spid=46327373,Morimi Tomihiko
104,Gia Tộc Thần Bí ,https://tiki.vn/product-p14513731.html?spid=14513732,Morimi Tomihiko
105,Bạn Gái Vs. Bạn Thời Thơ Ấu – Tập 2,https://tiki.vn/product-p10581580.html?spid=10581581,Yuji Yuji
106,Cô Gái Văn Chương - Nhà Văn Mới Nổi Và Biên Tập Viên,https://tiki.vn/product-p9343416.html?spid=69322454,Nomura Mizuki
107,Bạn Gái Vs. Bạn Thời Thơ Ấu – Tập 1,https://tiki.vn/product-p5079355.html?spid=5079357,Yuji Yuji
108,Cô Gái Văn Chương Và Nhà Văn Hướng Về Chúa Trời (Tập 8) - Tái Bản,https://tiki.vn/product-p1933179.html?spid=1933517,Nomura Mizuki
109,Hành Trình Của Elaina (Tập 3),https://tiki.vn/product-p1661961.html?spid=14788945,"Jougi Shiraishi, Azume"
110,Arya Bàn Bên Thỉnh Thoảng Lại Trêu Ghẹo Tôi Bằng Tiếng Nga – Tập 5,https://tiki.vn/product-p275907782.html?spid=275910638,"Sunsunsun, Momoco"
111,Đợi Anh Trong Mùa Xuân Ngày Hôm Qua,https://tiki.vn/product-p275569216.html?spid=275569249,Mei Hachimoku
112,Người Gác Cây Long Não,https://tiki.vn/product-p275418626.html?spid=275418627,Keigo Higashino
113,Ác Nữ Trùng Sinh – Tập 1,https://tiki.vn/product-p274319398.html?spid=274319399,Hanmint
114,Ghost Hunt - Tập 1: Chuyện Ma Quỷ Ở Khu Học Xá Cũ - Tặng Kèm Postcard + Poster,https://tiki.vn/product-p273892611.html?spid=273892612,Fuyumi Ono
115,Unnamed Memory - Hồi Ức Không Tên - Tập 2 - Bản Đặc Biệt - Tặng Kèm Bookmark Lục Giác + Flyer,https://tiki.vn/product-p272369201.html?spid=272369202,Kuji Furumiya
116,Thế Giới Otome Game Thật Khắc Nghiệt Với Nhân Vật Quần Chúng (Tập 7),https://tiki.vn/product-p263800093.html?spid=263800095,Mishima Yomu
117,Ai Dám Bảo Rom-Com Không Có Ngoài Đời Thực - Tập 2,https://tiki.vn/product-p216409030.html?spid=216409032,"So Hajikano, Kuro Shiina"
118,Thế Giới Otome Game Thật Khắc Nghiệt Với Nhân Vật Quần Chúng (Tập 6),https://tiki.vn/product-p207841170.html?spid=207841172,Mishima Yomu
119,Chuyện Tình Thanh Xuân Bi Hài Của Tôi Quả Nhiên Là Sai Lầm - Tập 14,https://tiki.vn/product-p205000920.html?spid=205000924,Wataru WATARI
120,Holmes Ở Kyoto - Tập 6 - Tặng Kèm Postcard,https://tiki.vn/product-p197656794.html?spid=197656795,Mai Mochizuki
121,"Diệt Slime Suốt 300 Năm, Tôi Levelmax Lúc Nào Chẳng Hay (Tập 1) – Tái Bản",https://tiki.vn/product-p193099636.html?spid=193099637,Kisetsu Morita
122,"Combo Lan Rùa 5, 7 & 8: Tớ Thích Cậu Hơn Cả Harvard, Đi Hết Một Đời Anh Vẫn Là Của Em & Đợi Một Danh Phận, Cả Đời Oán Hận",https://tiki.vn/product-p186157565.html?spid=206144196,Lan Rùa
123,Combo 4 Quyển: Thế Giới Otomegame Thật Khắc Nghiệt Với Nhân Vật Quần Chúng (Tập 1 + 2 + 3 + 4) (Tặng Kèm Bookmark),https://tiki.vn/product-p176938319.html?spid=176938320,
124,Chuyện Tình Thanh Xuân Bi Hài Của Tôi Quả Nhiên Là Sai Lầm - Tập 13 - Bản Bìa Cứng - Tặng Kèm Bookmark Mica + Postcard Bế Hình + Standee Mica + Thẻ Quà Tặng (Tặng Ngẫu Nhiên),https://tiki.vn/product-p171581959.html?spid=171581975,Wataru WATARI
125,Napoleon Hill - Chiến Thắng Con Quỷ Trong Bạn,https://tiki.vn/product-p170384629.html?spid=170384630,
126,Nhân Vật Hạ Cấp Tomozaki - Tập 2 (Bản Giới Hạn) [Tặng Thẻ Normal + Thẻ Rare + 02 Bookmark 2 Mặt],https://tiki.vn/product-p167600203.html?spid=167600204,"Yuki Yaku, Fly"
127,Sói Và Gia Vị - Tập 17,https://tiki.vn/product-p166529599.html?spid=166529601,Hasekura Isuna
128,Khi Hikaru Còn Trên Thế Gian Này…… Fujitsubo (Tặng Kèm Bookmark),https://tiki.vn/product-p148000099.html?spid=148000100,Nomura Mizuki
129,"Bị Đuổi Khỏi Nhóm Anh Hùng, Tôi Muốn Sống Tự Do Tự Tại Ở Vương Đô - Tập 2 - Tặng Kèm Bookmark + Card PVC",https://tiki.vn/product-p147341646.html?spid=147341647,Kiki
130,OVERLORD - Tập 3: Valkyrie Khát Máu,https://tiki.vn/product-p146274350.html?spid=146274351,Maruyama Kugane
131,Sói Và Gia Vị 16,https://tiki.vn/product-p88074824.html?spid=88074826,Hasekura Isuna
132,Sói Và Gia Vị Tập 15 (Tặng Kèm Bookmark) [Riêng 1000 Cuốn Đầu Tiên Tặng Kèm Thẻ Nhân Vật Kẹp Trong Sách],https://tiki.vn/product-p75696176.html?spid=75696177,Hasekura Isuna
133,Khi Hikaru Còn Trên Thế Gian Này…… Rokujou (Tập 9),https://tiki.vn/product-p69403796.html?spid=68688358,Nomura Mizuki
134,"Diệt Slime Suốt 300 Năm, Tôi Levelmax Lúc Nào Chẳng Hay - Tập 9 (Tặng Kèm: 02 Postcard (9 x 14 cm) + 01 Bookmark)",https://tiki.vn/product-p67873659.html?spid=67873660,Morita Kisetsu
135,Vì Con Gái Tôi Có Thể Đánh Bại Cả Ma Vương - Tập 3,https://tiki.vn/product-p50247004.html?spid=50247006,CHIROLU
136,Sói Và Gia Vị (Tập 14),https://tiki.vn/product-p49305985.html?spid=69322618,Hasekura Isuna
137,"Diệt Slime Suốt 300 Năm, Tôi Levelmax Lúc Nào Chẳng Hay - Tập 7 (Bản Đặc Biệt Tặng Kèm Bookmark + Poster Số Lượng Có Hạn)",https://tiki.vn/product-p42217616.html?spid=48282055,Morita Kisetsu
138,Sói Và Gia Vị (Tập 8),https://tiki.vn/product-p2013203.html?spid=2013205,Isuna Hasekura
139,Hành Trình Trở Thành Nhà Thám Hiểm Của Chàng Lính Đánh Thuê Bần Hàn (Tập 4),https://tiki.vn/product-p276396473.html?spid=276396694,Mine
140,"Đợi Mưa, Đợi Gió, Đợi Bình An - Bản Quyền",https://tiki.vn/product-p276246208.html?spid=276432415,
141,[Light Novel] Hiệp Sĩ Lưu Ban - Tập 14 - Amakbooks,https://tiki.vn/product-p276106917.html?spid=276106919,Riku Misora
142,Về Chuyện Tôi Chuyển Sinh Thành Slime - Tập 4,https://tiki.vn/product-p275748866.html?spid=275749965,"Fuse, Mitz Vah"
143,Spy Room - Lớp Học Điệp Viên Tập 7: Hyoujin Monika,https://tiki.vn/product-p274743071.html?spid=274743273,Takemachi
144,Unnamed Memory – Hồi Ức Không Tên - Tập 3: Lời Thề Vĩnh Cửu - Quà tặng: Bookmark,https://tiki.vn/product-p274145502.html?spid=274145503,Kuji Furumiya
145,Chúa Tể Bóng Tối - Tập 2 - Tặng Kèm Character Card,https://tiki.vn/product-p273645227.html?spid=273645228,Daisuke Aizawa
146,Thiên Sứ Nhà Bên - Tập 7 - Tặng Kèm Bookmark,https://tiki.vn/product-p273156617.html?spid=273156618,Saekisan
147,Arya Bàn Bên Thỉnh Thoảng Lại Trêu Ghẹo Tôi Bằng Tiếng Nga – Tập 3,https://tiki.vn/product-p262871376.html?spid=262871379,"Sunsunsun, Momoco"
148,"Combo Lan Rùa 5, 7, 8: Tớ Thích Cậu Hơn Cả Harvard + Đi Hết Một Đời Anh Vẫn Là Của Em + Đợi Một Danh Phận, Cả Đời Oán Hận",https://tiki.vn/product-p259310837.html?spid=259310843,Lan Rùa
149,SPY ROOM – Lớp học điệp viên - (Ngoại truyện tập 1: Trận chiến cô dâu),https://tiki.vn/product-p197674390.html?spid=197674392,Takemachi
150,Ai dám bảo Rom-com không có ngoài đời thực? - Tập 1,https://tiki.vn/product-p196675037.html?spid=196675039,So Hajikano
151,Combo Chuông Gió (Tập 1+2 )- Tặng sổ tay xương rồng,https://tiki.vn/product-p194120870.html?spid=194120871,Vĩ Ngư
152,Ame Và Yuki - Những Đứa Con Của Sói (Tái Bản),https://tiki.vn/product-p188229181.html?spid=188229182,Hosoda Mamoru
153,Liệu Có Sai Lầm Khi Tìm Kiếm Cuộc Gặp Gỡ Định Mệnh Trong Dungeon - Tập 8 - Bản Giới Hạn - Tặng Kèm Bookmark + Bìa Áo,https://tiki.vn/product-p179584449.html?spid=179584450,"Fujino Omori,  Suzuhito Yasuda"
154,Chủ Tiệm Bánh Chiến Binh Và Cô Phục Vụ Người Máy (Tập 5),https://tiki.vn/product-p145898412.html?spid=145898415,Sow
155,Nhập môn Văn học So sánh - Ben Hutchinson (tủ sách Phê bình Văn học),https://tiki.vn/product-p275145589.html?spid=275145590,
156,Tiếng Việt Ân Tình Tập 1,https://tiki.vn/product-p274163238.html?spid=274163239,Lê Trọng Nghĩa
157,Từ Điển Tiếng Việt Của GS. Nguyễn Lân - Phê Bình Và Khảo Cứu ,https://tiki.vn/product-p270118300.html?spid=270118301,Hoàng Tuấn Công
158,150 thuật ngữ văn học (bìa mềm) - tái bản,https://tiki.vn/product-p249766452.html?spid=249766454,Lại Nguyên Ân
159,Sách Sổ Tay Sửa Lỗi Hành Văn (Tái bản năm 2021),https://tiki.vn/product-p178078817.html?spid=178078818,Cao Xuân Hạo - Trần Thị Tuyết Mai
160,Tiếng Việt Phương Nam - Tiếng Việt Giàu Đẹp,https://tiki.vn/product-p171580942.html?spid=171580943,Trần Thị Ngọc Lang
161,Ai Làm Đau Tiếng Việt?,https://tiki.vn/product-p149531835.html?spid=149531836,Hồ Xuân Mai
162,Cổ Học Tinh Hoa (Bìa Cứng) (Tái Bản),https://tiki.vn/product-p145092091.html?spid=145092092,"Ôn Như Nguyễn Văn Ngọc, Tử An Trần Lê Nhân"
163,Yêu Sách Của Antigone: Thân Tộc Giữa Sự Sống Và Cái Chết,https://tiki.vn/product-p136235818.html?spid=136235819,Judith Butler
164,"Nguyễn Xuân Khánh - Một Nụ Cười Mỉm, Một Nghiệp Văn Xuôi",https://tiki.vn/product-p126676467.html?spid=126676468,Nhiều tác giả
165,Tiếng Người Trong Văn (Hồi Ức Văn Chương),https://tiki.vn/product-p125924594.html?spid=125924595,Nguyễn Xuân Khánh
166,Để Thành Nhà Văn (Tái Bản 2021),https://tiki.vn/product-p85560152.html?spid=90928952,"Thu Giang Nguyễn Duy Cần, Thu Giang Nguyễn Duy Cần "
167,Việt Ngữ Nghiên Cứu,https://tiki.vn/product-p74571434.html?spid=76249971,Phan Khôi
168,Tác Phẩm Bảo Vật Quốc Gia - Hồ Chí Minh (Hộp 5 Cuốn),https://tiki.vn/product-p66955380.html?spid=66955381,Hồ Chí Minh
169,Hiu Hắt Quê Hương Bến Cỏ Hồng,https://tiki.vn/product-p58971163.html?spid=58971164,
170,"Viết Khi Tâm Đắc (Tiểu Luận, Phê Bình, Chân Dung Văn Học)",https://tiki.vn/product-p57913621.html?spid=57913622,Ngô Văn Giá
171,60 Năm Văn Học Đương Đại Trung Quốc,https://tiki.vn/product-p52393313.html?spid=52393314,Trình Quang Vỹ
172,Các Lý Thuyết Và Phương Pháp Văn Học,https://tiki.vn/product-p22446009.html?spid=22446010,.
173,Khúc Hoan Ca Của Văn Chương,https://tiki.vn/product-p11123190.html?spid=11123191,Trần Lê Hoa Tranh
174,Văn Học Hiện Thực Và Văn Học Suy Đồi Anh Thế Kỷ XIX,https://tiki.vn/product-p4291931.html?spid=4332199,Lê Đình Cúc
175,Nhân Vật Phù Trợ Trong Truyện Cổ Tích Thần Kỳ Người Việt,https://tiki.vn/product-p4291913.html?spid=4332181,Hà Đan
176,Combo Chuyện Đông Chuyện Tây (Trọn Bộ 4 Cuốn),https://tiki.vn/product-p2158833.html?spid=2158835,An Chi
177,Bước Đường Của Cải Lương,https://tiki.vn/product-p2014117.html?spid=2014201,Nguyễn Tuấn Khanh
178,Nhà văn và Cuộc sống số 21 - Hội Nhà Văn Việt Nam,https://tiki.vn/product-p276440934.html?spid=276440935,Hội Nhà Văn
179,Nhà văn và Cuộc sống số 20 - Hội Nhà Văn Việt Nam,https://tiki.vn/product-p275417262.html?spid=275417263,Hội Nhà Văn
180,Combo 4 Cuốn Tứ Thư: Đại Học + Luận Ngữ + Trung Dung + Mạnh Tử (Sbooks),https://tiki.vn/product-p275377763.html?spid=275592553,
181,Nhập môn Văn học Trẻ em - Kimberly Reynolds (tủ sách Phê bình Văn học),https://tiki.vn/product-p275044610.html?spid=275044611,Kimberly
182,Tiếng Việt Ân Tình,https://tiki.vn/product-p274372073.html?spid=274372074,
183,Tự Chủ Văn Chương và Sứ Mệnh Tự Do,https://tiki.vn/product-p271222797.html?spid=271222798,"Đoàn Ánh Dương, Phùng Ngọc Kiên"
184,Hương sắc trong vườn văn,https://tiki.vn/product-p206673082.html?spid=206673083,Nguyễn Hiến Lê
185,Bùi Xuân Phái - Con mắt của trái tim,https://tiki.vn/product-p187827434.html?spid=187827437,Nhiều tác giả
186,Nhặt chuyện văn nhân (Chân dung văn học),https://tiki.vn/product-p169307916.html?spid=169307917,
187,Ngôn Ngữ Và Thân Xác,https://tiki.vn/product-p168303298.html?spid=168303299,Nguyễn Văn Trung
188,Ca Tụng Thân Xác,https://tiki.vn/product-p168303291.html?spid=168303293,Nguyễn Văn Trung
