book_id,name,link,authors
1044,The Exorcist - Quỷ Ám,https://tiki.vn/product-p275621591.html?spid=275621592,William Peter Blatty
1045,Bất thường,https://tiki.vn/product-p275481994.html?spid=275481995,Thanh Nguyên
1046,Bóng tối giữa chúng ta,https://tiki.vn/product-p275020971.html?spid=275020972,John Marrs
1047,Ma Y Thế Gia tập 1,https://tiki.vn/product-p274745585.html?spid=274745586,
1048,Vào vùng nước xoáy,https://tiki.vn/product-p274242096.html?spid=274242097,Edgar Allan Poe
1049,Bách Qủy Dạ Hành,https://tiki.vn/product-p274050519.html?spid=274050542,"Toriyama Sekien, Epic - Linh Lan"
1050,Edogawa Ranpo Tuyển Tập - Những Tội Ác Bất Dung Thứ,https://tiki.vn/product-p273869078.html?spid=273869079,Edogawa Ranpo
1051,Ma Qủy Dân Gian Ký Tập 2,https://tiki.vn/product-p273672301.html?spid=273672442,Duy Văn
1052,Kẻ Sát Nhân Ở Số Nhà 21,https://tiki.vn/product-p273283637.html?spid=273283639,Stanislas-André Steeman
1053,17 âm 1,https://tiki.vn/product-p272895670.html?spid=272895672,Doo Vandenis
1054,Bức Tranh Kỳ Quái,https://tiki.vn/product-p271808190.html?spid=271808191,Uketsu
1055,Kẻ Săn Người,https://tiki.vn/product-p260847315.html?spid=260847316,Maureen Callahan
1056,Thú Tội,https://tiki.vn/product-p248755023.html?spid=248755027,Minato Kanae
1057,Ma Quỷ Dân Gian Ký,https://tiki.vn/product-p213704979.html?spid=213704982,Duy Văn
1058,Hoàng hôn của bầy mãnh thú,https://tiki.vn/product-p200780120.html?spid=200780123,Marc Levy
1059,Billy Summers - Vụ ám sát cuối cùng - Stephen King,https://tiki.vn/product-p185410041.html?spid=185410042,Stephen King
1060,The Shining - Thị Kiến,https://tiki.vn/product-p185242031.html?spid=185242032,Stephen King
1061,Ngôi Làng Cổ Mộ (Tái Bản),https://tiki.vn/product-p181915295.html?spid=181915298,Thục Linh
1062,Những Đồ Vật Có Linh Hồn,https://tiki.vn/product-p162205263.html?spid=162205267,Tống Ngọc
1063,Bóng Trăng Trắng Ngà,https://tiki.vn/product-p114937975.html?spid=114937977,Thục Linh
1064,Nắm Bàn Tay Lạnh Giá,https://tiki.vn/product-p114046586.html?spid=114046587,Robert Aickman
1065,Combo 2 cuốn Độc Giả Thứ 7+ Đề Thi Đẫm Máu (Tặng kèm bookmark ),https://tiki.vn/product-p15733996.html?spid=15733997,.
1066,Quái Thú,https://tiki.vn/product-p2782211.html?spid=20460407,C. J. Skuse
1067,Yêu Miêu – Ký Sự Yêu Quái Thành Trường An,https://tiki.vn/product-p275946549.html?spid=275947202,Trương Vân
1068,Đêm Biến Mất,https://tiki.vn/product-p275571106.html?spid=275571107,Lisa Jewell
1069,Thầy Sờ Cốt,https://tiki.vn/product-p275551326.html?spid=275551442,Nhất Cố Tử Căng
1070,Thị Trấn Ma Cà Rồng - Stephen King,https://tiki.vn/product-p275401834.html?spid=275401835,Stephen King
1071,"Xin Chào, Tôi Là Người Dọn Xác",https://tiki.vn/product-p275140688.html?spid=275140692,Đại Sư Huynh
1072,"Sách-  Combo Ngôi Nhà Kỳ Quái và Bức Tranh Kỳ Quái của Uketsu, Tiểu Thuyết Trinh Thám Kinh Dị, Tặng kèm Bookmark và Bản Thiết Kế Các Ngôi Nhà- 2HBooks",https://tiki.vn/product-p274317864.html?spid=274317865,Uketsu
1073,Con Thú Mù,https://tiki.vn/product-p274245705.html?spid=274245706,Edogawa Ranpo
1074,Kẻ Cuối Cùng Trong Sáu Người,https://tiki.vn/product-p274123940.html?spid=274123941,Stanislas-André Steeman
1075,Sách - Sự Sụp Đổ Của Nhà Usher - Tuyển Tập Truyện Ngắn Kinh Dị - Edgar Allan Poe - Phuc Minh Books,https://tiki.vn/product-p273593571.html?spid=273593572,Edgar Allan Poe
1076,"(In màu toàn bộ, Combo 2 tập) MA QUỶ DÂN GIAN KÝ Tập 1, 2 – Duy Văn – Linh Lan Books - NXB Hội Nhà Văn",https://tiki.vn/product-p273574443.html?spid=273694226,
1077,Ác Duyên – Duyên Khởi,https://tiki.vn/product-p273385533.html?spid=273385534,"Linh Lan, Rosie Nguyễn"
1078,Trại Hè Kinh Hoàng,https://tiki.vn/product-p272648544.html?spid=272648547,Nancy Bush
1079,BÀN TRÒN TRÍ MẠNG TẬP 3 + 4,https://tiki.vn/product-p262782341.html?spid=262782343,Tiếu Thanh Tranh
1080,Kẻ Song Trùng,https://tiki.vn/product-p253361064.html?spid=253361070,Stephen King
1081,24 Nhân Cách Của Billy Milligan,https://tiki.vn/product-p229714485.html?spid=229714487,Daniel Keyes
1082,Đồng Linh Dị Truyện – Quỷ Triền Thân,https://tiki.vn/product-p214497211.html?spid=214497218,Tống Ngọc
1083,Misery - Chiếc Máy Đánh Chữ Đẫm Máu Ở Vùng Núi Tuyết,https://tiki.vn/product-p212213016.html?spid=212213017,Stephen King
1084,Những Câu Hỏi Lớn Từ Người Phàm Trần Tí Hon Về Cái Chết,https://tiki.vn/product-p184781427.html?spid=184781429,Caitlin Doughty
1085,Gã Hề Ma Quái - Tập 2,https://tiki.vn/product-p166319868.html?spid=166319869,Stephen King
1086,Combo 2 Cuốn Gã Hề Ma Quái (Bản Thường),https://tiki.vn/product-p166319855.html?spid=166319856,Stephen King
1087,Gã Hề Ma Quái - Tập 1,https://tiki.vn/product-p166319841.html?spid=166319842,Stephen King
1088,Nam Thiên Chí Dị (Truyện Dị Thường),https://tiki.vn/product-p77665453.html?spid=77665455,Bs. Kỳ Hương
1089,Illustrated Classics - Những Câu Chuyện Ma Hay Nhất Thế Giới,https://tiki.vn/product-p62633902.html?spid=62633903,Nhiều tác giả
1090,Lên Lớp Không Được Đọc Tiểu Thuyết,https://tiki.vn/product-p13935123.html?spid=13935124,Cửu Bả Đao
1091,Vật Chủ (Tiểu Thuyết Khoa Học Viễn Tưởng) - Tái Bản ,https://tiki.vn/product-p556179.html?spid=249383979,Hợp kim
1092,The Killer Across The Table - Bên Kia Chiến Tuyến,https://tiki.vn/product-p275107228.html?spid=275107229,"Mark Olshaker, John E. Douglas"
1093,Vong Hồn,https://tiki.vn/product-p274649731.html?spid=274649733,Trường Lê
1094,"Sách- Ngôi Nhà Kỳ Quái của Uketsu, Tiểu Thuyết Trinh Thám Kinh Dị, Tặng kèm Bản Thiết Kế Ngôi Nhà & Bookmark (Tái bản 2024)- 2HBooks",https://tiki.vn/product-p274314563.html?spid=274314564,Uketsu
1095,Trò Chơi Giẫm Bóng,https://tiki.vn/product-p273962508.html?spid=273962511,Okamoto Kido
1096,Dê Mắt Quỷ,https://tiki.vn/product-p273952855.html?spid=273952856,Chan-Ho-Kei
1097,Khu Rừng Ma Ám,https://tiki.vn/product-p263980796.html?spid=263980797,C.J.Cooke
1098,Danh Sách Mua Sắm Của Kẻ Sát Nhân,https://tiki.vn/product-p263053844.html?spid=263053846,Jiyong Kang
1099,Linh Hồn Nhật Bản,https://tiki.vn/product-p253712409.html?spid=253712410,
1100,Thị Trấn Bị Nguyền Rủa - HEX,https://tiki.vn/product-p248755021.html?spid=248755025,Thomas Olde Heuvelt
1101,Ngôi Nhà Kỳ Quái,https://tiki.vn/product-p205506466.html?spid=205506467,Uketsu
1102,Lời Nguyền Của Màn Đêm,https://tiki.vn/product-p201933789.html?spid=201933790,V. E Schwab
1103,Cây Cam Ngọt Của Tôi,https://tiki.vn/product-p176902310.html?spid=275086587,
1104,Sách - Gã hề ma quái Tập 1 - 1980BOOKS,https://tiki.vn/product-p168470218.html?spid=272251852,Stephen King
1105,Sách-Tác Phẩm Bảo Vật Quốc Gia,https://tiki.vn/product-p143144301.html?spid=272573922,Hồ Chí Minh
1106,Ring - Vòng Tròn Ác Nghiệt (Tái Bản 2019),https://tiki.vn/product-p15397969.html?spid=20426324,Suzuki Koji
1107,Hành Trình Của Hổ  (Phần 3 series Tình Hổ),https://tiki.vn/product-p3035263.html?spid=3035265,Colleen Houck
1108,Độc Giả Thứ 7,https://tiki.vn/product-p1042922.html?spid=84594209,Lôi Mễ
1109,Trung Hoa Bách Quỷ Lục (Kỳ Thư Về Các Loài Ma Quỷ Trung Quốc),https://tiki.vn/product-p275676366.html?spid=275693051,Linh Lan Books
1110,Nhục Hồng Ngải - Những Đứa Trẻ Mất Tích ( Tặng kèm sổ tay xương rồng ),https://tiki.vn/product-p273516691.html?spid=273516692, Thục Linh
1111,Sách Truyện Kinh Dị - Chiếc Xe Kéo Ma (Tuyển Chọn Truyện Ngắn Kinh Dị Của Rudyard Kipling),https://tiki.vn/product-p253274970.html?spid=253274971,
1112,Khế ước bán dâu - Thục Linh,https://tiki.vn/product-p185360753.html?spid=274183205, Thục Linh
1113,Bàn về sự chậm rãi - Cho những ai không muốn thúc ép thời gian hoặc bị thời gian thúc ép,https://tiki.vn/product-p276525604.html?spid=276525608,Pierre Sansot
1114,Tết cỏ ngọt,https://tiki.vn/product-p274352192.html?spid=274352193,Robin Wall Kimmerer
1115,Ông Trùm Cuối Cùng (Mario Puzo),https://tiki.vn/product-p273119845.html?spid=238701,Mario Puzo
1116,Mẹ làm gì có ước mơ,https://tiki.vn/product-p242424688.html?spid=242424691,Hạ Mer
1117,Người Đàn Ông Mang Tên Ove (Tái Bản 2022),https://tiki.vn/product-p202879294.html?spid=202879295,Fredrik Backman
1118,Circe,https://tiki.vn/product-p195662905.html?spid=195662907,Madeline Miller
1119,Nhật ký Đặng Thùy Trâm,https://tiki.vn/product-p187843291.html?spid=187843293,Đặng Thùy Trâm
1120,Bàn Có Năm Chỗ Ngồi (Tái Bản 2022),https://tiki.vn/product-p186290802.html?spid=186290805,Nguyễn Nhật Ánh
1121,Còn chút gì để nhớ (Tái Bản 2022),https://tiki.vn/product-p186290796.html?spid=186290799,Nguyễn Nhật Ánh
1122,Trại Hoa Vàng (Tái Bản 2022),https://tiki.vn/product-p186286174.html?spid=186286179,Nguyễn Nhật Ánh
1123,Trường An Ly Ca 3 – Cao Sơn Lưu Thuỷ,https://tiki.vn/product-p185888686.html?spid=185888687,Úc Phức
1124,Shuggie Bain: Chiếc Linh Hồn Nhỏ,https://tiki.vn/product-p181699672.html?spid=181699673,Douglas Stuart
1125,Những Ngã Tư Và Những Cột Đèn,https://tiki.vn/product-p181699664.html?spid=181699665,Trần Dần
1126,Nếu Biết Trăm Năm Là Hữu Hạn,https://tiki.vn/product-p177487151.html?spid=177487152,Phạm Lữ Ân
1127,Cuộc Đời Ngắn Lắm Đừng Ôm Muộn Phiền,https://tiki.vn/product-p176550203.html?spid=176550204,Mộc Nhi
1128,Tạm Biệt Tôi Của Nhiều Năm Về Trước,https://tiki.vn/product-p162844699.html?spid=162844704,An
1129,Thư Tình Gửi Một Người (Trịnh Công Sơn) (Tái Bản),https://tiki.vn/product-p157432540.html?spid=157432541,Trịnh Công Sơn
1130,Hong Tay Khói Lạnh (Tản Văn Nguyễn Ngọc Tư),https://tiki.vn/product-p153518828.html?spid=153518829,Nguyễn Ngọc Tư
1131,Kiếp Người - Vĩnh Cửu Và Vô Thường ,https://tiki.vn/product-p145977548.html?spid=145977549,Vũ Hoàng Long
1132,Chia Rẽ - Tại Sao Chúng Ta Đang Sống Trong Thời Đại Của Những Bức Tường,https://tiki.vn/product-p145288026.html?spid=145288028,Tim Marshall
1133,Vang Bóng Một Thời (Việt Nam Danh Tác),https://tiki.vn/product-p121185868.html?spid=121185871,Nguyễn Tuân
1134,Thương Nhớ Mười Hai (Việt Nam Danh Tác) (Tái Bản),https://tiki.vn/product-p120509490.html?spid=120509492,Vũ Bằng
1135,Tôi Nói Gì Khi Nói Về Chạy Bộ,https://tiki.vn/product-p120219394.html?spid=120219395,Haruki Murakami
1136,"Thiên Tài Bên Trái, Kẻ Điên Bên Phải (Tái Bản)",https://tiki.vn/product-p109017985.html?spid=109017987,Cao Minh
1137,Người Bà Tài Giỏi Vùng Saga,https://tiki.vn/product-p95289208.html?spid=95289212,Yoshichi Shimada
1138,"Những Đêm Không Ngủ, Những Ngày Chậm Trôi",https://tiki.vn/product-p87226756.html?spid=87226759,A Crazy Mind team
1139,Phụ Nữ Hiểu Biết Sẽ Có Cuộc Sống Đẳng Cấp Hơn (Tặng Kèm Bookmark),https://tiki.vn/product-p77324132.html?spid=77324133,Jenny Kiều
1140,"Gửi Bạn, Người Đã Kiệt Sức Vì Những Chịu Đựng Âm Thầm [Tặng Kèm: 1 Bookmark Daisy]",https://tiki.vn/product-p74981856.html?spid=74981857,Geulbaewoo
1141,Hẹn Nhau Phía Sau Tan Vỡ,https://tiki.vn/product-p69764547.html?spid=71104902,An 
1142,Tắt Đèn (Tái Bản 2020),https://tiki.vn/product-p55605172.html?spid=55605173,Ngô Tất Tố
1143,"Có Một Ngày, Bố Mẹ Sẽ Già Đi",https://tiki.vn/product-p54614797.html?spid=54614798,Nhiều tác giả
1144,"Tác Phẩm Kinh Điển: Thiên Tài Bên Trái, Kẻ Điên Bên Phải / Sách Văn Học Hay (Tặng Kèm Bookmark Thiết Kế Bookmark Happy Life)",https://tiki.vn/product-p41556498.html?spid=222723835,Cao Minh
1145,Trưởng Thành Sau Ngàn Lần Tranh Đấu (Tái Bản),https://tiki.vn/product-p4466841.html?spid=4466843,Kim Ran Do
1146,Yêu Những Điều Không Hoàn Hảo,https://tiki.vn/product-p3954355.html?spid=3955615,Hae Min
1147,Điều Kỳ Diệu Của Tiệm Tạp Hóa NAMIYA (Tái Bản),https://tiki.vn/product-p3304875.html?spid=3304877,Higashino Keigo
1148,Nhà (Tái Bản),https://tiki.vn/product-p3048355.html?spid=3070291,Nguyễn Bảo Trung
1149,Walden - Một Mình Sống Trong Rừng,https://tiki.vn/product-p535576.html?spid=114245617,Henry David Thoreau
1150,Về Nhà Ăn Bát Cháo Hành,https://tiki.vn/product-p276504681.html?spid=276504682,Doãn Hằng
1151,Tiếng Anh Du Ký - My English Journey,https://tiki.vn/product-p276401022.html?spid=276401024,Lee Việt
1152,Ba nghìn thế giới thơm,https://tiki.vn/product-p275611105.html?spid=275611107,Nhật Chiêu
1153,"Nơi Nào Có Mẹ, Nơi Ấy Là Nhà",https://tiki.vn/product-p274599269.html?spid=274599608,Hạ Mer
1154,Sách - Combo 4 Cuốn Lén Nhặt Chuyện Đời + Dẫu Có Ra Đi Vẫn Sẽ Cười + Ai Rồi Cũng Sẽ Bình Yên + Lữ Khách Ven Đường (Sbooks),https://tiki.vn/product-p271729831.html?spid=271982411,
1155,Hãy Chăm Sóc Mẹ,https://tiki.vn/product-p249374002.html?spid=249374003,Shin Kyung-sook
1156,Hồ (Kawabata Yasunari),https://tiki.vn/product-p198644079.html?spid=198644081,Kawabata Yasunari
1157,Những Giấc Mơ Ở Hiệu Sách Morisaki,https://tiki.vn/product-p197657913.html?spid=197657916,Yagisawa Satoshi
1158,Như Cơn Gió Thoảng - Nghĩ Về Những Qui Luật Cuộc Sống,https://tiki.vn/product-p197344441.html?spid=197344444,Nguyễn Văn Tuấn
1159,Tuyển Tập Truyện Ngắn Miyazawa Kenji,https://tiki.vn/product-p192452461.html?spid=192452462,Miyazawa Kenji
1160,Hà Nội trong mắt một người. Lan man nghìn năm phố,https://tiki.vn/product-p192124403.html?spid=192124404,Đỗ Phấn
1161,Chúc Ngủ Ngon Rồi Lại Càng Nhớ Anh Hơn - Tặng Kèm 3 Postcard,https://tiki.vn/product-p188534640.html?spid=188534641,Alan Chen
1162,Chuyện Cổ Tích Dành Cho Người Lớn (Tái Bản 2022),https://tiki.vn/product-p186290795.html?spid=186290798,Nguyễn Nhật Ánh
1163,Đi qua hoa cúc (Tái Bản 2022),https://tiki.vn/product-p186290790.html?spid=186290794,Nguyễn Nhật Ánh
1164,Thằng Quỷ Nhỏ (Tái Bản 2022),https://tiki.vn/product-p186286186.html?spid=186286188,Nguyễn Nhật Ánh
1165,Lời Nguyền Gái Miền Tây,https://tiki.vn/product-p184243098.html?spid=184243099,Ngô Tú Ngân
1166,"Thành Phố Thì To, Tôi Thì Nhỏ",https://tiki.vn/product-p181699612.html?spid=181699615,Thất Thiên Lộ Quá
1167,Ngồi Khóc Trên Cây,https://tiki.vn/product-p171549946.html?spid=171549948,Nguyễn Nhật Ánh
1168,Một Ý Niệm An Nhiên,https://tiki.vn/product-p166033458.html?spid=166033460,Trang Ps
1169,Nam Cao - Sống Mòn (Bìa Cứng) (Tái Bản),https://tiki.vn/product-p162100197.html?spid=162100198,Nam Cao
1170,Khói Trời Lộng Lẫy (Tập Truyện Ngắn Nguyễn Ngọc Tư)(Tái Bản),https://tiki.vn/product-p160370181.html?spid=160370182,Nguyễn Ngọc Tư
1171,Tiện Nhân Ở Phố,https://tiki.vn/product-p147931869.html?spid=147931871,Phạm Trung Tuyến
1172,Đệ Tử Quy (Tái Bản),https://tiki.vn/product-p137694321.html?spid=137694322,Lý Dục Tú
1173,Những Người Đàn Ông Không Có Đàn Bà (Tái Bản),https://tiki.vn/product-p99513994.html?spid=99513995,Haruki Murakami
1174,Người yêu ơi,https://tiki.vn/product-p89768848.html?spid=89768849,Đỗ Bích Thúy
1175,Bóng của cây sồi,https://tiki.vn/product-p89764009.html?spid=89764010,Đỗ Bích Thúy
1176,"Chúng Ta Rồi Sẽ Hạnh Phúc, Theo Những Cách Khác Nhau [Tặng Kèm: 01 Bookmark]",https://tiki.vn/product-p76388962.html?spid=76388963,Thảo Thảo
1177,Những Ngày Thơ Ấu (Việt Nam Danh Tác),https://tiki.vn/product-p76012201.html?spid=76012202,Nguyên Hồng
1178,"Ta Bắt Đầu Cuộc Đời Mới, Khi Nhận Ra Mình Chỉ Sống Một Lần",https://tiki.vn/product-p76012191.html?spid=76012192,Raphaëlle Giordano
1179,Ăn Để Nhớ - Tản Văn,https://tiki.vn/product-p68688349.html?spid=68688350,Kim Em
1180,Sông - Nguyễn Ngọc Tư (Tiểu Thuyết)(Tái Bản),https://tiki.vn/product-p58063000.html?spid=58063001,Nguyễn Ngọc Tư
1181,Utopia - Địa đàng trần gian (Tái Bản 2020),https://tiki.vn/product-p57211757.html?spid=57211758,Thomas More
1182,Bà Ngoại Thời @ ( Tái Bản ),https://tiki.vn/product-p20889775.html?spid=20889776,Susie Morgenstern
1183,Hành Lý Hư Vô,https://tiki.vn/product-p16440471.html?spid=16440472,Nguyễn Ngọc Tư
1184,Chúc Một Ngày Tốt Lành (Tái Bản 2019),https://tiki.vn/product-p12574283.html?spid=12574284,Nguyễn Nhật Ánh
1185,Truyện Kiều,https://tiki.vn/product-p464132.html?spid=172950,Nguyễn Du
1186,Sayings Of Youth - Lời Nói Của Thanh Xuân,https://tiki.vn/product-p275068585.html?spid=275068586,
1187,Trăng Tan Đáy Nước,https://tiki.vn/product-p273961038.html?spid=273961039,Hoàng Yến
1188,Quê Nội,https://tiki.vn/product-p273122283.html?spid=273122286,Võ Quảng
1189,Tật xấu người Việt,https://tiki.vn/product-p272430555.html?spid=272430556,Di Li
1190,Nghệ thuật tiểu thuyết,https://tiki.vn/product-p263980366.html?spid=263980367,Milan Kundera
1191,Hoa hồng xứ khác,https://tiki.vn/product-p262695606.html?spid=186290809,Nguyễn Nhật Ánh
1192,Chú Bé Rắc Rối,https://tiki.vn/product-p262695598.html?spid=186290811,Nguyễn Nhật Ánh
1193,Bên Trời Hoa Bay,https://tiki.vn/product-p276608338.html?spid=276608340,Mạc Chẩm
1194,Showbiz Là Của Tôi Tập 3,https://tiki.vn/product-p276528015.html?spid=276528016,Xuân Đao Hàn
1195,ComBo Bộ sách Ma Y Thế Gia 2 tập,https://tiki.vn/product-p276428048.html?spid=276428049,
1196,Đuổi Theo Mùa Hạ - Tập 2,https://tiki.vn/product-p276414124.html?spid=276415258,Mộc Qua Hoàng
1197,Không Yêu Không Vui,https://tiki.vn/product-p276396485.html?spid=276398417,Mộng Tiêu Nhị
1198,Câu Chuyện Không Ai Biết Ấy,https://tiki.vn/product-p276167216.html?spid=276167259,Twentine
1199,Xin Lỗi Vì Không Biết Đó Là Lần Cuối,https://tiki.vn/product-p276098485.html?spid=276098488,Phùng Dĩ Lượng
1200,Đuổi Theo Mùa Hạ - Tập 1,https://tiki.vn/product-p276098484.html?spid=276105723,Mộc Qua Hoàng
1201,"Đường Đời Muôn Ngả, Gặp Gỡ Đã Là Nhân Duyên",https://tiki.vn/product-p276077522.html?spid=276078027,Lư Tư Hạo
1202,Trở Về Năm Tháng Bố Tôi Là Hot Boy,https://tiki.vn/product-p275946093.html?spid=275946390,Xuân Phong Lựu Hỏa
1203,Thái Hồng – Có Em Trong Đời,https://tiki.vn/product-p275296457.html?spid=275297117,Giá Oản Chúc
1204,Năm Xuân Thứ Hai Tám,https://tiki.vn/product-p274399500.html?spid=274399681,Nhĩ Đông Thố Tử
1205,Trêu Nhầm Tập 2,https://tiki.vn/product-p272421631.html?spid=272421635,Kiều Diêu
1206,Trêu Nhầm Tập 1,https://tiki.vn/product-p271626741.html?spid=271626747,Kiều Diêu
1207,Chuông Gió - Tập 2,https://tiki.vn/product-p194085910.html?spid=194085911,Vĩ Ngư
1208,Chuông Gió (Tập 2),https://tiki.vn/product-p193211309.html?spid=193211311,Vĩ Ngư
1209,Viên Tiên Sinh Luôn Không Vui - Tập 1 - Tặng Kèm Bookmark Chuột Hamster + Postcard Chữ Ký Tác Giả,https://tiki.vn/product-p192949765.html?spid=192949766,Từ Từ Đồ Chi
1210,Đạo Tình Tập 2 (Tái Bản),https://tiki.vn/product-p181122295.html?spid=181122296,Chu Ngọc
1211,Quán Cơm Tỳ Hưu Chỉ Có Vào Không Có Ra (Bộ 2 Tập),https://tiki.vn/product-p180400018.html?spid=180400019,Hải Kinh Lạc
1212,Hoa Hải Đường Chưa Ngủ,https://tiki.vn/product-p173479574.html?spid=173479575,Yên La
1213,Anh Đừng Quyến Rũ Tôi - Tập 3,https://tiki.vn/product-p170870035.html?spid=170870036,Tiêu Đường Đông Qua
1214,Trúc Thư Dao 1 - Nước Tần - Có Nàng Tên Thập,https://tiki.vn/product-p168234722.html?spid=168234723,Văn Giản Tử
1215,Tiệm Đồ Cổ Á Xá - Tập 5 (Tặng Kèm Sổ Ngoại Truyện + Bookmark),https://tiki.vn/product-p160692420.html?spid=160692421,Huyền Sắc
1216,Tiên Mãn Cung Đường - Tập 1,https://tiki.vn/product-p138269724.html?spid=138269726,Lục Dã Thiên Hạc
1217,Tiên Mãn Cung Đường - Tập 2,https://tiki.vn/product-p138269675.html?spid=138269676,Lục Dã Thiên Hạc
1218,Gió Tây Bao Nhiêu Hận Thổi Chẳng Giãn Mày Chau,https://tiki.vn/product-p105375429.html?spid=105375430,Bạch Lạc Mai
1219,Môn Đồ - Bắt Cóc Đệ Đệ Tập 4,https://tiki.vn/product-p88917475.html?spid=94904263,"Tiểu Xuyên Công Tử, Manh A Công Tử"
1220,Năm Đầu Tiên Khi Tôi 30 (Bộ 2 Cuốn),https://tiki.vn/product-p74811080.html?spid=74811081,Mao Lợi
1221,Hình Xăm,https://tiki.vn/product-p73107479.html?spid=73107481,Bất Vấn Tam Cửu
1222,Hải Thượng Sinh Minh Nguyệt (Tặng Kèm Postcard + Bookmark),https://tiki.vn/product-p69107154.html?spid=69107155,Thương Thái Vi
1223,Lạc Trì (2 Tập),https://tiki.vn/product-p59395854.html?spid=59395856,Dư Trình
1224,Ngàn Năm Chờ Đợi - Diệp Lạc Vô Tâm,https://tiki.vn/product-p49649751.html?spid=58338609,Diệp Lạc Vô Tâm
1225,Chân Trời Góc Bể (Tái Bản),https://tiki.vn/product-p49253288.html?spid=49253289,Diệp Lạc Vô Tâm
1226,Mãi Mãi Là Bao Xa (Tái Bản 2019),https://tiki.vn/product-p23413038.html?spid=23413039,Diệp Lạc Vô Tâm
1227,"Sao Trên Trời Rất Xa, Sao Của Anh Thật Gần",https://tiki.vn/product-p3794225.html?spid=3794393,Phỉ Ngã Tư Tồn
1228,Bữa Trưa Tình Yêu (Ấn Bản Kỷ Niệm) - Bổ Sung 5 Ngoại Truyện,https://tiki.vn/product-p422011.html?spid=125771,Cố Mạn
1229,0852,https://tiki.vn/product-p276450479.html?spid=276450483,Giải Tổng
1230,Sách Cái Áo Duyên - Vân Võ,https://tiki.vn/product-p276239163.html?spid=276239167,
1231,Trường An 12 Canh Giờ (Tập 2),https://tiki.vn/product-p275452244.html?spid=275452305,Mã Bá Dung
1232,Như Sơ,https://tiki.vn/product-p274743537.html?spid=274743538,Việt Chi
1233,Thiên Quan Tứ Phúc - Tập 3,https://tiki.vn/product-p274724105.html?spid=274724108,Mặc Hương Đồng Khứu
1234,Bảy Năm Vẫn Ngoảnh Về Phương Bắc (Tập 8+9),https://tiki.vn/product-p274472030.html?spid=274472298,Ân Tầm
1235,Cá Voi Cô Đơn - Hàm Yên,https://tiki.vn/product-p274145626.html?spid=274145649,Hàm Yên
1236,Chiều Em Đau Cả Trái Tim,https://tiki.vn/product-p273835817.html?spid=273835821,Túy Hậu Ngư Ca
1237,Đã Nhiều Năm Như Thế - Tập 2,https://tiki.vn/product-p272187684.html?spid=272187692,Bát Nguyệt Trường An
1238,Vượt qua thời không để yêu anh 2,https://tiki.vn/product-p262731038.html?spid=262731040,Diệp Lạc Vô Tâm
1239,Sơn Trà Nở Muộn,https://tiki.vn/product-p251885302.html?spid=251885303,Giá Oản Chúc
1240,Gió Nam Thầm Thì,https://tiki.vn/product-p249663536.html?spid=249663537,Thất Vi
1241,Đường Gia Tiểu Miêu,https://tiki.vn/product-p178240500.html?spid=178240503,Triêu Tiểu Thành
1242,Anh Đừng Quyến Rũ Tôi - Tập 1,https://tiki.vn/product-p170870041.html?spid=170870042,Tiêu Đường Đông Qua
1243,Cậu Chủ Hồ Đồ (Tái Bản 2020),https://tiki.vn/product-p106349669.html?spid=106349670,Tinh Dã Anh
1244,Tìm em giữa ngàn sao lấp lánh (trọn bộ 2 tập),https://tiki.vn/product-p98686182.html?spid=235537025,
1245,"Combo Trọn Bộ 2 Tập: Uống Nhầm Một Ánh Mắt, Cơn Say Theo Cả Đời (Tặng Kèm: 01 Bookmark Chó Husky + 06 Postcard/Mỗi Tập 03 Postcard)",https://tiki.vn/product-p70038951.html?spid=71682382,Lạc Vi Gian Mỗ Mỗ
1246,All In Love - Ngập Tràn Yêu Thương (Tái Bản 2020),https://tiki.vn/product-p54682252.html?spid=56127860,Cố Tây Tước
1247,Bến Xe (Tái Bản 2020),https://tiki.vn/product-p53789573.html?spid=53789574,Thương Thái Vi
1248,Bến Hồng Trần - Tập 2,https://tiki.vn/product-p50883575.html?spid=50883576,Diệp Lạc Vô Tâm
1249,Lật Hạ Ký (Bộ 2 Tập),https://tiki.vn/product-p48040527.html?spid=48040528,Cửu Nguyệt Hi
1250,Chiêu Diêu Tập 1,https://tiki.vn/product-p43476283.html?spid=43476284,Cửu Lộ Phi Hương
1251,Chiêu Diêu Tập 2,https://tiki.vn/product-p43476281.html?spid=43476282,Cửu Lộ Phi Hương
1252,"Gió Ngừng Thổi, Tình Còn Vương",https://tiki.vn/product-p42966080.html?spid=42966081,Diệp Lạc Vô Tâm
1253,Trời Sinh Một Cặp,https://tiki.vn/product-p22070586.html?spid=24594011,Tiểu Thư Ngưu Ma Vương
1254,Combo Đạo Tình (Bộ 2 tập - Tái bản 2018) Tặng kèm bookmark yêu thương,https://tiki.vn/product-p14890554.html?spid=92680171,Chu Ngọc
1255,Dám Kháng Chỉ Chém (Tái Bản),https://tiki.vn/product-p3317201.html?spid=20436668,Lam Ngả Thảo
1256,"Sách tiểu thuyết GỤC TRƯỚC DỊU DÀNG - Giang La La (Quýt dịch, Celia Nguyễn hiệu đính)",https://tiki.vn/product-p276236053.html?spid=276236054,Giang La
1257,Sách Khôn Ninh tập 1 - Thời Kính,https://tiki.vn/product-p276182963.html?spid=276182965,
1258,Ác Ma Triệu Hồi,https://tiki.vn/product-p274459134.html?spid=274459680,Nhất Mai Đồng Tiền
1259,Shipper Lục Giới,https://tiki.vn/product-p273961034.html?spid=273961035,Nhất Mai Đồng Tiền
1260,"Chỉ Muốn Thương Anh, Chiều Anh, Nuôi Anh",https://tiki.vn/product-p273179728.html?spid=273179729,Túy Hậu Ngư Ca
1261,Đường Về,https://tiki.vn/product-p252770230.html?spid=252770231,Mặc Bảo Phi Bảo
