book_id,name,link,authors
1630,Kinh tế học thời khó nhọc,https://tiki.vn/product-p272269829.html?spid=272269830,"Esther Duflo, Abhijit V. Banerjee"
1631,Combo TIM MARSHALL (3 CUỐN),https://tiki.vn/product-p210277474.html?spid=210277481,Tim Marshall
1632,Quyền Lực Của Địa Lý - The Power Of Geography,https://tiki.vn/product-p206840682.html?spid=206840683,Tim Marshall
1633,GIÁO TRÌNH KINH TẾ BẤT ĐỘNG SẢN,https://tiki.vn/product-p195928146.html?spid=195928147,
1634,Tiếp thị 4.0 - Dịch chuyển từ truyền thống sang công nghệ số,https://tiki.vn/product-p194960733.html?spid=194960734,"Philip Kotler, Hermawan Kartajaya, Iwan Setiawan"
1635,The Experience Economy: Nền Kinh Tế Trải Nghiệm - Biến Dịch Vụ Của Bạn Thành Trải Nghiệm Khách Hàng,https://tiki.vn/product-p182480871.html?spid=182487116,"B. Joseph Pine, James H. Gilmore"
1636,Cường Quốc Trong Tương Lai,https://tiki.vn/product-p177321527.html?spid=177321528,Hamada Kazuyuki
1637,KINH TẾ NHẬT BẢN - Giai đoạn phát triển thần kỳ 1955-1973,https://tiki.vn/product-p176591074.html?spid=177253555,
1638,"Blockchain: Bản Chất Của Blockchain, Bitcoin, Tiền Điện Tử, Hợp Đồng Thông Minh Và Tương Lai Của Tiền Tệ",https://tiki.vn/product-p140221935.html?spid=140221941, Mark Gates
1639,Tư Vấn Bảo Hiểm - Những Kỹ Năng Không Ai Nói Với Bạn (Tập 3: Để Chốt Hợp Đồng Không Một Lời Từ Chối),https://tiki.vn/product-p98242583.html?spid=98242584,"Lê Minh, Lê Minh,  Lê Minh"
1640,Tư Bản Thế Kỷ 21,https://tiki.vn/product-p82996522.html?spid=82996523,Thomas Piketty
1641,"Tinh Hoa Kinh Tế Học (Essentials Of Economics) - Paul Krugman, Robin Wells - PACE Books",https://tiki.vn/product-p73609401.html?spid=73856990,"Paul Krugman, Robin Wells"
1642,Nhà nước Khởi tạo: Giải những huyền thoại về vai trò của nhà nước và khu vực tư nhân,https://tiki.vn/product-p73585908.html?spid=79662546,Mariana Mazzucato
1643,Tư Vấn Bảo Hiểm - Những Kỹ Năng Không Ai Nói Với Bạn (Tập 1),https://tiki.vn/product-p57696329.html?spid=57696330,
1644,Lược Sử Kinh Tế Học,https://tiki.vn/product-p51244265.html?spid=51244266,Niall Kishtainy
1645,Economix - Các Nền Kinh Tế Vận Hành (Và Không Vận Hành) Thế Nào Và Tại Sao?,https://tiki.vn/product-p44976191.html?spid=44976192,Michael Goodwin
1646,Doanh Nghiệp Của Thế Kỷ 21 (Tái Bản 2019),https://tiki.vn/product-p32219488.html?spid=33095730,"Robert T Kiyosaki,  John Fleming,  Kim Kiyosaki"
1647,Đừng Bán Bảo Hiểm Hãy Trao Giải Pháp,https://tiki.vn/product-p11841468.html?spid=11841469,Pilot Nguyễn
1648,The Truth Machine: Blockchain Và Tương Lai Của Tiền Tệ,https://tiki.vn/product-p1613345.html?spid=1613347,"Paul Vigna, Michael J. Casey"
1649,Nhà Tự Nhiên Kinh Tế,https://tiki.vn/product-p997533.html?spid=1002141,Robert H. Frank
1650,HBR - Ra Quyết Định Dựa Trên Phân Tích Dữ Liệu - Alpha Books ,https://tiki.vn/product-p276463046.html?spid=276463047,
1651,Kệ hàng trống: Đứt gãy chuỗi cung ứng trong nền kinh tế toàn cầu,https://tiki.vn/product-p275756751.html?spid=275756753,James Rickards
1652,Minh Triết Về Nỗi Sợ - Một Góc Nhìn Sau Đại Dịch,https://tiki.vn/product-p275698416.html?spid=275698420,Mikki Willis
1653,[Pre-order] Chính Sách Tiền Tệ Thế Kỷ 21,https://tiki.vn/product-p274084760.html?spid=274084761,Ben S. Bernanke
1654,Trạm Đọc | Chính Sách Tiền Tệ Thế Kỷ 21,https://tiki.vn/product-p273888753.html?spid=273900506,"Ben S.Bernanke, Ben S. Bernanke"
1655,Bứt phá thời số hóa: Bảy khối kiến tạo chuyển đổi số thành công,https://tiki.vn/product-p272269837.html?spid=272269838,Nitin Seth
1656,Tư Duy Kinh Tế: 50 Bài Giảng Để Hiểu Quy Luật Làm Giàu,https://tiki.vn/product-p272268605.html?spid=272268606,
1657,Tư duy như nhà kinh tế học,https://tiki.vn/product-p270883270.html?spid=270883271,Anne Rooney
1658,Trung Quốc Thoát Khỏi Bẫy Nghèo Như Thế Nào,https://tiki.vn/product-p254132213.html?spid=254132214,
1659,Nền Kinh Tế Tăng Trưởng Và Sụp Đổ Như Thế Nào? (Tái Bản 2023),https://tiki.vn/product-p249921335.html?spid=249921336,"Peter D Schiff,  Andrew J Schiff"
1660,The Membership Economy - Kinh Tế Thành Viên (Robbie Kellman Baxter) - Bản Quyền,https://tiki.vn/product-p209901064.html?spid=209901065,
1661,Bank 4.0 (Tái Bản 2022),https://tiki.vn/product-p198898970.html?spid=198898971,Brett King
1662,Chiến Tranh Tiền Tệ - Phần 1 - Ai Thực Sự Là Người Giàu Nhất Thế Giới? (Tái bản 2022),https://tiki.vn/product-p170870069.html?spid=170870070,Song Hong Bing
1663,12 Xu Hướng Công Nghệ Trong Thời Đại 4.0,https://tiki.vn/product-p13329803.html?spid=55880801,Kevin Kelly
1664,BITCOIN - Bong Bóng Tài Chính Hay Tương Lai Của Tiền Tệ,https://tiki.vn/product-p2013617.html?spid=2013659,Mark Gates
1665,Cuộc Cách Mạng Blockchain,https://tiki.vn/product-p1954469.html?spid=1954573,"Don Tapscott, Alex Tapscott"
1666,Tứ Đại Quyền Lực,https://tiki.vn/product-p1667313.html?spid=1667443,Scott Galloway
1667,Blockchain – Khởi Nguồn Cho Một Nền Kinh Tế Mới,https://tiki.vn/product-p1387547.html?spid=1389525,Melanie Swan
1668,Một Nửa Của 13 Là 8 (Tái Bản 2018),https://tiki.vn/product-p1355395.html?spid=73776332,Jack Foster
1669,Từ Tốt Đến Vĩ Đại,https://tiki.vn/product-p572433.html?spid=8461026,Jim Collins
1670,Lời Nói Có Đáng Tin,https://tiki.vn/product-p385268.html?spid=85156,Joe Navarro
1671,"VIỆT NAM: NGÔI SAO ĐANG LÊN CỦA CHÂU Á – Brook Taylor, Sam Korsmoe – Lê Hồng Vân dịch – Quảng Văn – NXB Hồng Đức",https://tiki.vn/product-p275942420.html?spid=275971438,nhieu tac gia
1672,Đầu Tư Vào Vàng - Bản Quyền,https://tiki.vn/product-p275066023.html?spid=275281654,JONATHAN SPALL
1673,Kinh doanh sự lựa chọn,https://tiki.vn/product-p274668052.html?spid=274668054,Matthew Willcox
1674,Kinh Tế Học (Tập 2),https://tiki.vn/product-p274527880.html?spid=274527881,
1675,Kinh Tế Học Trần Trụi - Naked Economics - Tiếp Cận Kinh Tế Học Dưới Góc Nhìn Dễ Dàng Và Hiệu Quả Nhất,https://tiki.vn/product-p274469962.html?spid=59547288, Thomas Armstrong
1676,Thời Đại Thứ Tư,https://tiki.vn/product-p270792626.html?spid=270792627,
1677,Combo Sách Chiến Tranh Tiền Tệ (Bộ 5 Phần),https://tiki.vn/product-p208615263.html?spid=208615265,Song Hong Bing
1678,Chiến Tranh Tiền Tệ - Phần V (Phần Cuối),https://tiki.vn/product-p207317580.html?spid=207317581,Song Hong Bing
1679,"BLOCKCHAIN: Bản Chất Của Blockchain, Bitcoin, Tiền Điện Tử, Hợp Đồng Thông Minh và Tương Lai Của Tiền Tệ (Tái Bản)",https://tiki.vn/product-p199547423.html?spid=199547424,Mark Gates
1680,Chiến Tranh Tiền Tệ Phần IV: Siêu Cường Về Tài Chính - Tham Vọng Về Đồng Tiền Chung Châu Á,https://tiki.vn/product-p192949360.html?spid=192949361,Song Hong Bing
1681,Công Dân Toàn Cầu - Công Dân Vũ Trụ,https://tiki.vn/product-p192880206.html?spid=192880207,Phan Văn Trường
1682,Kochland - Đế Chế Koch,https://tiki.vn/product-p174651589.html?spid=175810453,
1683,Tư Vấn Bảo Hiểm - Những Kỹ Năng Không Ai Nói Với Bạn (Tập 2: Để Trở Thành Tư Vấn Viên Vạn Người Mê),https://tiki.vn/product-p101613041.html?spid=101613042,"Lê Minh, Lê Minh,  Lê Minh"
1684,Chiến Lược Đại Dương Xanh (Bìa Cứng),https://tiki.vn/product-p76200813.html?spid=89651934,W.Chan Kim
1685,Kinh Tế Học Viking,https://tiki.vn/product-p73107475.html?spid=73107476,George Lakey
1686,Bản Sắc - Nhu Cầu Phẩm Giá Và Chính Trị Phẫn Nộ,https://tiki.vn/product-p67325081.html?spid=69337182,Francis Fukuyama
1687,Combo 6 Cuốn Sách Của Tác Giả Malcolm Gladwell: Chú Chó Nhìn Thấy Gì + David & Goliath + Điểm Bùng Phát + Đọc Vị Người Lạ +  Những Kẻ Xuất Chúng +  Trong Chớp Mắt,https://tiki.vn/product-p65099027.html?spid=69851693,Malcolm Gladwell
1688,Tương Lai Thuộc Về Châu Á,https://tiki.vn/product-p56305508.html?spid=56305509,Parag Khanna
1689,Các Quy tắc trong Kinh tế học,https://tiki.vn/product-p14754511.html?spid=257856131,
1690,Những Kẻ Xuất Chúng (Tái Bản 2019),https://tiki.vn/product-p13332055.html?spid=276231863,Malcolm Gladwell
1691,Kinh Tế Trong Cuộc Cách Mạng Công Nghệ 4.0,https://tiki.vn/product-p12107548.html?spid=20491087,Saifedean  Ammous
1692,The Three Laws Of Performance - Ba Quy Luật Của Hiệu Quả ,https://tiki.vn/product-p7256303.html?spid=249766047,"Dave Logan, Steve Zaffron"
1693,Vũ Trụ (Tái Bản),https://tiki.vn/product-p2393619.html?spid=214177703,Carl Sagan
1694,Mastering Bitcoin - Bitcoin Thực Hành: Những Khái Niệm Cơ Bản Và Cách Sử Dụng Đúng Đồng Tiền Mã Hóa,https://tiki.vn/product-p1582315.html?spid=1582403,Andreas M. Antonopoulos
1695,Đánh Bại Lạm Phát,https://tiki.vn/product-p274247759.html?spid=274247760,"Hermann Simon, Andreas Stoffers"
1696,Kinh tế học Phật Giáo - Kai Romhardt,https://tiki.vn/product-p247782555.html?spid=247782558,
1697,Dạy Con Làm Giàu - Tập 5 - Để Có Sức Mạnh Về Tài Chính (Tái Bản 2022),https://tiki.vn/product-p217535512.html?spid=217535513,
1698,KINH TẾ CÁC QUỐC GIA KHU VỰC ASEAN,https://tiki.vn/product-p215416575.html?spid=215416576,
1699,KINH TẾ NHẬT BẢN ,https://tiki.vn/product-p177190716.html?spid=177190717,Trần Văn Thọ
1700,Quản Trị Chất Lượng Chuỗi Cung Ứng,https://tiki.vn/product-p137165015.html?spid=221233325,
1701,Sách - Tuyển Tập Bất Bình Đẳng,https://tiki.vn/product-p120036547.html?spid=216934135,nhieu tac gia
1702,Những Kẻ Xuất Chúng (Tái Bản),https://tiki.vn/product-p92732216.html?spid=95005800,Malcolm Gladwell
1703,Từ nền kinh tế lớn đến cường quốc kinh tế,https://tiki.vn/product-p42132977.html?spid=42132978,
1704,Bắt Đầu Với Câu Hỏi Tại Sao - Nghệ Thuật Truyền Cảm Hứng Trong Kinh Doanh,https://tiki.vn/product-p275909699.html?spid=275909706,Simon Sinek
1705,Chat GPT Thực Chiến,https://tiki.vn/product-p275702538.html?spid=275702540,"Dịch Dương, Phan Trách Bân, Lý Thế Minh"
1706,Nguyên Lý 80/20 - Bí Quyết Làm Ít Được Nhiều,https://tiki.vn/product-p273316208.html?spid=273316211,Richard Koch
1707,AI - Công Cụ Nâng Cao Hiệu Suất Công Việc,https://tiki.vn/product-p272129446.html?spid=272129447,"Ravin Jesuthasan, John W. Boudreau"
1708,Khéo Ăn Nói Bán Hàng Thành Công (Bìa Mềm),https://tiki.vn/product-p271479936.html?spid=271479939,Bích Phương
1709,Làm Chủ Giọng Nói Trong Đầu,https://tiki.vn/product-p270660457.html?spid=270660460,Blair Singer
1710,Chat GPT - Ứng Dụng Trí Tuệ Nhân Tạo Trong Công Việc,https://tiki.vn/product-p263066347.html?spid=263066348,
1711,Đọc vị bất kỳ ai - Để không bị lợi dụng (Tái bản),https://tiki.vn/product-p205010302.html?spid=205010303,David J. Liebermen
1712,Suy Nghĩ Thống Kê Trong Đời Thường,https://tiki.vn/product-p197634201.html?spid=197634202,Nguyễn Văn Tuấn
1713,Xây Dựng Để Trường Tồn - Các Thói Quen Thành Công Của Những Tập Đoàn Vĩ Đại Và Hàng Đầu Thế Giới,https://tiki.vn/product-p189336449.html?spid=189336454,"Jim Collins, Jerry Porras"
1714,Nơi Làm Việc Nhân Văn,https://tiki.vn/product-p176550197.html?spid=176550200,Andy Swann
1715,Bí Quyết Tìm Kiếm Mặt Bằng Kinh Doanh - Đến Sahara Mở Quán Trà Đá - Bộ Sách Khởi Nghiệp Bán Lẻ,https://tiki.vn/product-p175845415.html?spid=175845416,
1716,Khám Phá Vận Mệnh - 7 Bước Đánh Thức Bản Thân,https://tiki.vn/product-p173515430.html?spid=173515432,Robin Sharma
1717,Quy Tắc Làm Việc Của Google (Tái Bản),https://tiki.vn/product-p171549938.html?spid=171549939,Laszlo Bock
1718,Sức Mạnh Của Việc Đặt Câu Hỏi Đúng (Tái Bản),https://tiki.vn/product-p169546331.html?spid=169546332,Mihiro Matsuda
1719,Sách Người Giỏi Không Phải Là Người Làm Tất Cả (Tái Bản 2021),https://tiki.vn/product-p153045603.html?spid=153045604,"Ph.D, Donna M. Genett"
1720,Storytelling With Data: Let’S Practice! - Thực Hành Kể Chuyện Thông Qua Dữ Liệu!,https://tiki.vn/product-p138226289.html?spid=138226290,Cole Nussbaumer Knaflic
1721,Tiếp Thị 5.0: Công Nghệ Vị Nhân Sinh,https://tiki.vn/product-p129381098.html?spid=129381099,"Philip Kotler, Hermawan Kartajaya, Iwan Setiawan"
1722,Nghệ Thuật Đánh Cắp Ý Tưởng (10 Bí Mật Không Ai Nói Với Bạn Về Sáng Tạo),https://tiki.vn/product-p77109209.html?spid=77109210,Austin Kleon
1723,Storytelling With Data - Kể Chuyện Thông Qua Dữ Liệu (Cuốn Cẩm Nang Hướng Dẫn Trực Quan Hóa Dữ Liệu),https://tiki.vn/product-p76013378.html?spid=76013379,Cole Nussbaumer Knaflic
1724,Muốn Thành Công Nói Không Với Trì Hoãn – 21 Nguyên Tắc Vàng Đập Tan Sự Trì Hoãn,https://tiki.vn/product-p67991610.html?spid=67991611,Damon Zahariades
1725,Nhà Đầu Tư Thông Minh (Tái Bản 2020),https://tiki.vn/product-p57762732.html?spid=57762733,Benjamin Graham
1726,Chiếc Lexus & Cây Ôliu (Tái Bản 2020),https://tiki.vn/product-p57049003.html?spid=57049006,Thomas L. Friedman
1727,"Tái Tạo Tổ Chức: Phá Vỡ Rào Cản, Thổi Bùng Sinh Khí (Tái Bản)",https://tiki.vn/product-p49204092.html?spid=49204094,Frederic Laloux
1728,Để Hiệu Quả Trong Công Việc (Tái Bản 2019),https://tiki.vn/product-p39521136.html?spid=39521138,Brian Tracy
1729,Dấn Thân (Tái Bản),https://tiki.vn/product-p14684312.html?spid=14684313,"Sherryl Sandberg, Nell Scovell"
1730,Đọc Nhiều Nhớ Được Bao Nhiêu?,https://tiki.vn/product-p13333355.html?spid=13333356,Zion Kabasawa
1731,Nghệ Thuật Tư Duy Chiến Lược,https://tiki.vn/product-p12138656.html?spid=12138657,"Avinash K. Dixit, Barry J. Nalebuff"
1732,45 Giây Tạo Nên Thay Đổi - Thấu Hiểu Tiếp Thị Mạng Lưới,https://tiki.vn/product-p10227722.html?spid=10227723,Don Failla
1733,5 Điểm Chết Trong Teamwork,https://tiki.vn/product-p7958959.html?spid=7958960,Patrick Lencioni
1734,Bán Đảo Ả Rập: Tinh Thần Hồi Giáo Và Thảm Kịch Dầu Mỏ,https://tiki.vn/product-p5808777.html?spid=20475827,Nguyễn Hiến Lê
1735,Thịnh Vượng Tài Chính Tuổi 30 - Tập 2 (Tái Bản),https://tiki.vn/product-p2473637.html?spid=2476719,Go Deuk Seong
1736,Nghệ Thuật PR Bản Thân (Tái Bản 2018),https://tiki.vn/product-p1938895.html?spid=1939041,Austin Kleon
1737,"Phụ Nữ Hiện Đại Nghĩ Giàu Và Làm Giàu - Cuốn Sách Mang Đến Kim Chỉ Nam Thành Công, Hạnh Phúc Cho Một Nửa Thế Giới",https://tiki.vn/product-p1625603.html?spid=1625605,Sharon Lechter
1738,Dốc Hết Trái Tim - Cách Starbucks Xây Dựng Công Ty Bằng Từng Tách Cà Phê (Tái Bản 2018),https://tiki.vn/product-p1565657.html?spid=1566605,"Howard Schultz, Dori Jones Yang"
1739,Sức Mạnh Của Việc Đặt Câu Hỏi Tại Sao,https://tiki.vn/product-p1053642.html?spid=1053674,C. Richard Weylman
1740,Sách - Chat GPT Thực Chiến - Sử Dụng AI Hiệu Quả Trong Sáng Tạo Nội Dung Marketing,https://tiki.vn/product-p275952072.html?spid=275952073,"Dịch Dương, Lý Thế Minh"
1741,Vượt hiệu suất: Bí quyết làm việc của những bậc thầy tốc độ,https://tiki.vn/product-p275932576.html?spid=275932577,
1742,Tăng Tốc Bán Hàng Bằng SPIN,https://tiki.vn/product-p275875006.html?spid=275875009,Neil Rackham
1743,Storytelling With You – Kể Chuyện Từ Chính Bạn,https://tiki.vn/product-p274455494.html?spid=274455495,Cole Nussbaumer Knaflic
1744,Quảng Cáo Theo Phong Cách Ogilvy,https://tiki.vn/product-p273134989.html?spid=273134992,David Ogilvy
1745,Ai Che Lưng Cho Bạn,https://tiki.vn/product-p270660559.html?spid=270660562,Keith Ferrazzi
1746,Kỹ Năng Quản Lý Thời Gian,https://tiki.vn/product-p202796284.html?spid=202796285,"Jake Knapp, John Zeratsky"
1747,Mỗi Ngày Tiết Kiệm Một Giờ,https://tiki.vn/product-p192909302.html?spid=192909303,Michael Heppell
1748,"Sống theo phương thức 80/20: Bớt công việc, bớt ưu phiền, thêm thành công, thêm niềm vui sống",https://tiki.vn/product-p191781259.html?spid=191781261,Richard Koch
1749,Thuật Thiết Lập Và Hoàn Thành Mục Tiêu,https://tiki.vn/product-p178032065.html?spid=178032066,Zig Ziglar
1750,Everybody Writes - Ai Rồi Cũng Viết (Cuốn Cẩm Nang Giúp Bạn Viết Content “Chất Như Nước Cất”),https://tiki.vn/product-p150838230.html?spid=150838231,Ann Handley
1751,Sức Mạnh Của Tập Trung (Tái Bản),https://tiki.vn/product-p137741276.html?spid=137741279,"Jack Canfield, Mark Victor Hansen, Les Hewitt"
1752,Sách Để Trở Thành Người Bán Hàng Xuất Sắc (Tái Bản),https://tiki.vn/product-p74173572.html?spid=74173573,Jeffrey J Fox
1753,Vòng Lặp Ooda - Phương Pháp Ra Quyết Định Và Hành Động Tối Ưu Trong Công Việc,https://tiki.vn/product-p73923118.html?spid=73923119,Hiroyuki Irie
1754,Tái Tạo Mô Hình Kinh Doanh Hiệu Quả,https://tiki.vn/product-p73166878.html?spid=73166880,Mark W. Johnson
1755,"OKRs - Hiểu Đúng, Làm Đúng - Cách Để Áp Dụng Thành Công OKRs Ngay Từ Đầu",https://tiki.vn/product-p69219921.html?spid=69219922,Mai Xuân Đạt
1756,Nghệ Thuật Từ Chối – Cách Nói Không Mà Vẫn Có Được Đồng Thuận,https://tiki.vn/product-p67991600.html?spid=67991601,Damon Zahariades
1757,Quản Lý Thời Gian Thông Minh Của Người Thành Đạt: Bí Quyết Thành Công Của Triệu Phú Anh,https://tiki.vn/product-p52399985.html?spid=54056011,Ducan Banatyne
1758,Lợi Thế Bán Hàng (Tái Bản),https://tiki.vn/product-p41299104.html?spid=41299105,Dale Carnegie
1759,Thịnh Vượng Tài Chính Tuổi 30 - Tập 1 (Tái Bản 2019),https://tiki.vn/product-p37118918.html?spid=37118919,Nhiều tác giả
1760,Khiêu Vũ Với Ngòi Bút (Tái Bản),https://tiki.vn/product-p33596834.html?spid=33596835,Joseph Sugarman
1761,Mục Tiêu,https://tiki.vn/product-p33492447.html?spid=33492448,"Eliyahu M. Goldratt, Jeff Cox"
1762,Đam Mê - Bí Quyết Tạo Thành Công (Tái Bản 2019),https://tiki.vn/product-p11221400.html?spid=11221401,Stephen R. Covey
1763,Hình Ảnh Của Bạn Đáng Giá Triệu Đô ( Tái Bản 2019),https://tiki.vn/product-p10192047.html?spid=10867647,Ingrid Zhang
1764,Từ Beirut Đến Jerusalem (Tái Bản 2018),https://tiki.vn/product-p2542279.html?spid=2567541,Thomas Friedman
1765,Những Bài Học Đầu Tư Từ Warren Buffett,https://tiki.vn/product-p1826115.html?spid=1826621,Lawrence A. Cunningham
1766,Phân Tích Chứng Khoán,https://tiki.vn/product-p1750249.html?spid=20490032,"Benjamin Graham, David L. Dodd"
1767,Mô Hình Kinh Doanh Nhóm,https://tiki.vn/product-p1732659.html?spid=20491436,"Tim Clark, Bruce Hazen"
1768,MBA Căn Bản,https://tiki.vn/product-p1665307.html?spid=55707501,Waseda Business School
1769,Phát Triển Kỹ Năng Lãnh Đạo (Tái Bản),https://tiki.vn/product-p1000276.html?spid=1000374,John C. Maxwell
1770,Cẩm Nang Tư Duy Học Tập Và Nghiên Cứu,https://tiki.vn/product-p275900290.html?spid=275900293,Richard Paul - Linda Elder
1771,Tư Duy Phản Biện,https://tiki.vn/product-p274802547.html?spid=274802551,Zoe McKey
1772,"Gieo Thói Quen Nhỏ, Gặt Thành Công Lớn",https://tiki.vn/product-p273911638.html?spid=74796722,Phillip Kerr
1773,Work Rules - Quy Tắc Làm Việc Của Google: Google Tuyển Dụng Và Giữ Chân Nhân Tài Như Thế Nào?,https://tiki.vn/product-p273896952.html?spid=70766580,Laszlo Bock
1774,Thuật Quản Lý Thời Gian,https://tiki.vn/product-p241899647.html?spid=241899651,Brian Tracy
1775,OKR - Bước Đột Phá Kép Trong Công Việc Và Cuộc Sống,https://tiki.vn/product-p221229393.html?spid=221229395,Diêu Quỳnh
1776,Brian Tracy - Thuật Hùng Biện,https://tiki.vn/product-p208198122.html?spid=208198124,Brian Tracy
1777,Khách Hàng Thật Sự Cần Gì?,https://tiki.vn/product-p206837193.html?spid=206837196,Jim Kalbach
1778,Dạy Con Làm Giàu 4 - Con Giàu Con Thông Minh - Để Có Khởi Đầu Thuận Lợi Về Tài Chính,https://tiki.vn/product-p200852596.html?spid=200852597,"Robert T. Kiyosaki, Sharon L. Lechter"
1779,Bí Kíp Chống Tụt MOOD,https://tiki.vn/product-p196284170.html?spid=196284171,Dr. Olivia Remes
1780,OKR Căn Bản,https://tiki.vn/product-p138504792.html?spid=138504794,Trần Lôi
1781,Dự Án Kỳ Lân,https://tiki.vn/product-p85396173.html?spid=85396174,Gene Kim
1782,OKRS - Nguyên Lý Và Thực Tiễn,https://tiki.vn/product-p79555994.html?spid=79555995,"Paul R Niven, Ben Lamorte"
1783,Siêu Tập Trung (Tái Bản),https://tiki.vn/product-p78975610.html?spid=78975611,Chris Bailey
1784,"Sách - Bán Bạc Cắc, Thu Bạc Tỷ - Dùng Bí Quyết Dễ Xài Để Bán Hàng Có Lãi",https://tiki.vn/product-p276567641.html?spid=276567642,
1785,Combo  Sách - 4 cuốn: Chat GPT + Chat GPT thực chiến + AI 5.0 + AI Công cụ nâng cao hiệu suất công việc,https://tiki.vn/product-p276439755.html?spid=276439756,
1786,P.Kotler. Tiếp thị 6.0: Tương lai là toàn nhập,https://tiki.vn/product-p276376962.html?spid=276376963,"Philip Kotler, Hermawan Kartajaya, Iwan Setiawan"
1787,"P.Kotler. Tiếp thị với tinh thần doanh chủ - Vượt qua sự chuyên nghiệp để hướng tới sáng tạo, lãnh đạo và bền vững",https://tiki.vn/product-p276376937.html?spid=276376939,"Philip Kotler, Hermawan Kartajaya, Hooi Den Huan, Jacky Mussry"
1788,Marketing Bán Lẻ Đa Kênh - 9 Bí Quyết Tiếp Thị Tinh Gọn Tạo Ngay Dòng Tiền,https://tiki.vn/product-p275793521.html?spid=275793522,
1789,Làm Chủ Thị Trường Ngách - Tái Bản,https://tiki.vn/product-p274949838.html?spid=274949839,Stephanie Chandler
1790,Sự Kết Thúc Của Marketing,https://tiki.vn/product-p242995008.html?spid=242995009,Carlos Gil
1791,Content Bạc Tỷ (Tái bản 2022),https://tiki.vn/product-p212356656.html?spid=212356658,Diệp Tiểu Ngư
1792,Kiểm Soát Chi Phí Mua Hàng Và Quản Lí Nhà Cung Cấp,https://tiki.vn/product-p198197156.html?spid=198197157,Chu Vân
1793,Đừng bao giờ đi ăn một mình,https://tiki.vn/product-p194960744.html?spid=194960745,"Keith Ferrazzi, Tahl Raz"
1794,Marketing Căn Bản (Tái bản),https://tiki.vn/product-p175700773.html?spid=175700780,Don Sexton
1795,TikTok Tất Tần Tật,https://tiki.vn/product-p171055469.html?spid=171055470,"Chiêu Thương Ca, Vương Phi Đồng"
1796,Nghệ Thuật Bán Hàng Bậc Cao - Bí Quyết Chốt Deal Mọi Thời Đại (Khổ Lớn)(Tái Bản),https://tiki.vn/product-p155463025.html?spid=155463026,Zig Ziglar
1797,Những Đòn Tâm Lý Trong Bán Hàng (Tái Bản),https://tiki.vn/product-p140360874.html?spid=140360875,Brian Tracy
1798,Trên Lưng Khổng Tượng - Kinh Doanh Online Trên Sàn Thương Mại Điện Tử - Khởi Nghiệp Với Bán Hàng Qua Mạng và Nhãn Hàng Riêng,https://tiki.vn/product-p136340700.html?spid=136340701,Trần Thanh Phong
1799,Hướng Dẫn Kiếm Tiền Trên TikTok,https://tiki.vn/product-p127814264.html?spid=127814265,
1800,"Quảng Cáo Không Nói Láo - Sự Thật Về Quảng Cáo Dưới Góc Nhìn Khoa Học, Toàn Diện Và Thực Tiễn",https://tiki.vn/product-p115702579.html?spid=115702580,Hồ Công Hoài Phương
1801,Mô Hình Phân Phối Và Bán Lẻ - Giải Pháp Cho Doanh Nghiệp Việt Nam (Tái Bản),https://tiki.vn/product-p111271288.html?spid=111271363,TS. Đào Xuân Khương
1802,Viết Đi Đừng Sợ! Từ Tay Không Thành Tay Viết,https://tiki.vn/product-p108501279.html?spid=108501280,Linh Phan
1803,Kỹ Năng Bán Hàng Tuyệt Đỉnh,https://tiki.vn/product-p104074997.html?spid=104074998,Grant Cardone
1804,22 Quy Luật Bất Biến Trong Marketing,https://tiki.vn/product-p93249197.html?spid=127538948,Jack Trout
1805,Nghệ Thuật Bán Hàng Bằng Câu Chuyện,https://tiki.vn/product-p75601401.html?spid=127524923,Paul Smith
1806,Lập Kế Hoạch Kinh Doanh Cho Người Mới Bắt Đầu,https://tiki.vn/product-p74616448.html?spid=74616449,Alex Genadinik
1807,Để Không Mất Thêm Một Khách Hàng Nào Nữa,https://tiki.vn/product-p71948001.html?spid=71948002,Joey Coleman
1808,Sách Người Bán Hàng Vĩ Đại Nhất Thế Giới (Tái Bản 2020),https://tiki.vn/product-p59262880.html?spid=59262881,Og Mandino
1809,Hiệu ứng chim mồi - Tập 3,https://tiki.vn/product-p56256828.html?spid=56464733,"Hạo Nhiên,  Quốc Khánh"
1810,Tiktok Marketing,https://tiki.vn/product-p55506686.html?spid=55506687,Markus Rach
1811,"Thế Giới Ảo, Thương Hiệu Thật",https://tiki.vn/product-p46107068.html?spid=46107069,Gary Vaynerchuk
1812,Cuộc Đời Của Pi ( Tái Bản 2019),https://tiki.vn/product-p14645351.html?spid=14645352,Yann Martel
1813,Chiến Lược Mở Rộng Kinh Doanh Từ Cốt Lõi,https://tiki.vn/product-p13853115.html?spid=13853116,Chris Zook
1814,GAM7 No.11 Promotion - Khuyến Mại,https://tiki.vn/product-p7556499.html?spid=7556501,RIO BOOK
1815,Thao Túng Tâm Lý Trong Marketing,https://tiki.vn/product-p276451696.html?spid=276451698,Michael A. Kamins
1816,Brand Marketing,https://tiki.vn/product-p276130424.html?spid=276130425,Lawrence Ingrassia
